Title,Link,Press,Description
"서울 핫플 성수동 팝업 스토어에서 마신 '고급 생수'의 충격적인 정체","https://www.wikitree.co.kr/articles/1010044","위키트리","수돗물을 마시는 비율이 20대 이하를 포함한 젊은 세대일수록 낮아지고, 먹는 샘물 구매 비율이 높아진다는 점에 착안해 2030세대를 대상으로 한 광고를... 가치소비를 추구하는 젊은 세대를 대상으로 환경을 위해 아리수를 마시는 행동이 '멋지다'라는 메시지를 담았다. '아리수 마시지 마세요' 편은 '지구를..."
"계엄 리스크·경기 침체에… 유통가 '설 선물' 사전예약 돌입","https://www.newscj.com/news/articleView.html?idxno=3211678","천지일보","고물가로 경기 침체가 지속되는 데다 지난 3일 윤석열 대통령의 비상계엄 선포까지 더해져 소비심리가 급격히 얼어붙은 가운데 대형마트·백화점 등... 특히 20대부터 70대까지 전 연령층에서 선호하는 한우와 주류 상품군이 확대됐다. 가성비 높은 2만∼6만원대 중저가 선물세트는 지난해 대비 약 10%, 중고가인..."
"[현장] 가성비 넘어선 갓성비…'버거옥' 신촌에 둥지 틀다","http://www.financialreview.co.kr/news/articleView.html?idxno=32151","파이낸셜리뷰","/사진=파이낸셜리뷰 DB/사진=파이낸셜리뷰 DB 버거옥은 13일 오픈행사 당일 매장을 찾은 소비자들에게 선착순으로 티셔츠를 나눠줬다. 개그맨 한민관씨가... 버거옥 관계자는 "햄버거는 20대의 젊은 대학생들이 좋아하는 메뉴고, 신촌역은 대학생들이 정말 많이 오가는 장소 아니냐"며 신촌역에 1호 매장을 오픈한..."
"경기평생학습포털 지식, 회원 수 400만명 돌파","http://www.shinailbo.co.kr/news/articleView.html?idxno=1978108","신아일보","생성형 인공지능 강좌, 2025년 새해 계획 세우기, 연말정산 준비, 2025년 대한민국 소비 트렌드, 크리스마스 트리 케이크 만들기 등으로 회원가입만 하면 누구나 신청 가능하다. 연령대별 회원가입 비중은 50대가 22.5%로 가장 높았으며, 40대(21.6%), 60대 이상(20.1%), 30대(17.5%), 20대(16.9%) 순을 차지해 대체로 전..."
"콘진원, 2024 콘텐츠 장르별 이용자 조사 보고서 5종 발간","http://www.thepowernews.co.kr/news/articleView.html?idxno=147698","더파워","특히 만화 이용 빈도는 10~20대의 굿즈 소비와 50~60대의 출판만화에 대한 익숙함 증대에 따라 전년 대비 2.0%p 증가한 18.3%로 나타났으며, 웹툰 이용 빈도는 전년 대비 3.9%p 증가한 66.7%로 조사됐다. 만화·웹툰 유형별 이용 경험은 포털사이트(89.1%)의 비율이 가장 높았다. 웹툰 유료 결제 경험은 47.2%로 전년..."
"국내 제약사, 너도나도 화장품 사업…"브랜드 차별화 관건"","http://www.metroseoul.co.kr/article/20241216500486","메트로신문","종근당건강은 클리덤의 '저분자 콜라겐' 기반 스킨케어 제품과 입술 메이크업 제품이 피부 고민을 가진 10대~20대 소비자들을 정조준할 수 있을 것으로 기대하고 있다. 종근당건강은 기존에는 피부건강기능화장품 브랜드 '씨케이디 개런티드'를 선보여 왔다. 종근당건강은 씨케이디 개런티드를 통해 화장품에..."
"[기획] 편의점 구독서비스, 고물가 속 이용자 급증","http://www.m-i.kr/news/articleView.html?idxno=1189991","매일일보","찾는 소비자들이 급증하고 있다. 편의점 구독서비스는 월 이용료를 지불하면 주요 상품을 할인 가격으로 이용할 수 있는 멤버십 서비스다.... 서비스 이용자 연령대는 20대 30%, 30대 33%, 40대 29%로 20~40대 이용자 수가 큰 비중을 차지하고 있다. 세븐일레븐도 간편식과 커피는 물론 주류에 대한..."
"경기도평생학습포털 ‘지식’ 회원 수 400만 돌파","http://www.breaknews.com/1078774","브레이크뉴스","대한민국 소비 트렌드 ▲크리스마스 트리 케이크 만들기 등으로 회원가입만 하면 누구나 신청 가능하다. 연령대별 회원가입 비중은 50대가 22.5%로 가장 높았으며, 40대(21.6%), 60대 이상(20.1%), 30대(17.5%), 20대(16.9%) 순을 차지해 대체로 전..."
""팀장이 왜 검토해요?" 질문도... 크게 달라진 회사 문화","https://www.ohmynews.com/NWS_Web/View/at_pg.aspx?CNTN_CD=A0003089221&CMPT_CD=P0010&utm_source=naver&utm_medium=newsearch&utm_campaign=naver_news","오마이뉴스","20대 Z세대 학생들과 대학에서 를 주제로 수업하면서 변화를 절감하는 일이 잦다. 수업 시간에 학생들은 질문은 안 해도 출석과 성적은 칼같이 챙긴다.... 모든 게 너무 빠르고 과다하게 소비된다는 생각이 든다. 나 같은 세대가 이해하기 어려운 부분이 많지만, 그 또한 현재 사람들의 사는 모습이다. 때로..."
"올해 모바일 게임-만화·웹툰·캐릭터 이용자 모두 증가","https://www.epnc.co.kr/news/articleView.html?idxno=310038","테크월드","특히 만화 이용 빈도는 10~20대의 굿즈 소비와 50~60대의 출판만화에 대한 익숙함 증대에 따라 전년 대비 2.0%p 증가한 18.3%로 조사됐으며 웹툰 이용 빈도는 전년 대비 3.9%p 증가한 66.7%로 분석됐다. 만화·웹툰 유형별 이용 경험은 포털사이트(89.1%)의 비율이 가장 높았다. 웹툰 유료 결제 경험은 47.2%로 전년..."
"국민 10명중 6명 게임한다...게임 유저 일평균 게임 시간 "주중 171분"","http://www.fnnews.com/news/202412161450202464","파이낸셜뉴스","특히 만화 이용 빈도는 10~20대의 굿즈 소비와 50~60대의 출판만화에 대한 익숙함 증대에 따라 전년 대비 2.0%p 증가한 18.3%로 나타났다. 웹툰 이용 빈도는 전년 대비 3.9%p 증가한 66.7%로 조사됐다. 만화·웹툰 유형별 이용 경험은 포털사이트(89.1%)의 비율이 가장 높았다. 웹툰 유료 결제 경험은 47.2%로 전년..."
"[MZ통통] MZ세대 달라진 트렌드...금융·소비패턴 등 가치관 변화 뚜렷","http://www.newsian.co.kr/news/articleView.html?idxno=75437","뉴시안","[사진=대학내일20대연구소] ［뉴시안= 신선경 기자］주력 소비층으로 떠오른 MZ세대가 금융생활부터 소비패턴, 뷰티, 가치관까지 변화가 뚜렷해지고 있다는 조사결과가 나왔다. 대학내일20대연구소는 2024년을 마무리하며 올해 트렌드와 세대별 인사이트를 살펴볼 수 있는 주요 데이터를 인포그래픽..."
"많이 벌고 많이 쓰는 X세대…부모·자녀 '이중부양'에 60%는 "노후준비 ...","https://www.getnews.co.kr/news/articleView.html?idxno=706555","글로벌경제","X세대는 매달 289만원을 소비했는데, 이는 M세대보다 70만원, 베이비부머 세대보다 49만원 많은 수준이다. 특히 식비, 통신비, 교통비 등 가계 생활에... 현재 혼인율은 당연히 아직 경제적 여건을 갖추지 못한 20대인 Z세대가 5.9%로 가장 낮았다. 30대가 되는 M세대는 55%를 넘어섰고, X세대는 75%가 기혼이었다...."
"[매경TV 핫플레이스] 문래역 상권 데이터 분석, 매출 59% 성장 비결","http://mbnmoney.mbn.co.kr/news/view?news_no=MM1005426477","매일경제TV","이는 방문객의 만족도, 소비의 충성도, 상권의 가치가 높다는 의미입니다. 상권이 본격적으로 도약한 2022년부터 2024년 10월까지 최근 3년간... 맛집 성지 된 문래역 상권으로 향하는 주말 저녁 20대 문래동2가의 공장 지대는 감각적인 분위기를 자랑하는 SNS 핫플레이스로, 문래동3가의 로데오 거리는..."
"한국콘텐츠진흥원, 2024 콘텐츠 장르별 이용자 조사 보고서 5종 발간","https://www.s-journal.co.kr/news/articleView.html?idxno=25874","S-저널","특히 만화 이용 빈도는 10~20대 굿즈 소비와 50~60대의 출판만화에 대한 익숙함 증대에 따라 전년 대비 2.0%p 증가한 18.3%로 나타났으며, 웹툰 이용 빈도는 전년 대비 3.9%p 증가한 66.7%로 조사됐다. 만화·웹툰 유형별 이용 경험은 포털사이트(89.1%) 비율이 가장 높았다. 웹툰 유료 결제 경험은 47.2%로 전년..."
"올해 게임이용률, 전년 대비 3%p 감소","https://www.gameshot.net/common/con_view.php?code=GA675fad92065fc","게임샷","특히 만화 이용 빈도는 10~20대의 굿즈 소비와 50~60대의 출판만화에 대한 익숙함 증대에 따라 전년 대비 2.0%p 증가한 18.3%로 나타났으며, 웹툰 이용 빈도는 전년 대비 3.9%p 증가한 66.7%로 조사됐다. 만화·웹툰 유형별 이용 경험은 포털사이트(89.1%)의 비율이 가장 높았다. 웹툰 유료 결제 경험은 47.2%로 전년..."
"[위클리오늘] 경기도평생학습포털 '지식', 회원 수 400만 돌파...19일까지...","http://www.weeklytoday.com/news/articleView.html?idxno=668701","위클리오늘","▲생성형 인공지능 강좌 ▲ 2025년 새해 계획 세우기 ▲연말정산 준비 ▲2025년 대한민국 소비 트렌드 ▲크리스마스 트리 케이크 만들기 등으로 회원가입만 하면 누구나 신청 가능하다. 연령대별 회원가입 비중은 50대가 22.5%로 가장 높았으며, 40대(21.6%), 60대 이상(20.1%), 30대(17.5%), 20대(16.9%) 순을 차지해..."
"경기도평생학습포털 `지식` 회원 수 400만 돌파","https://www.dt.co.kr/contents.html?article_no=2024121602109958082006&ref=naver","디지털타임스","생성형 인공지능 강좌, 2025년 새해 계획 세우기, 연말정산 준비, 2025년 대한민국 소비 트렌드, 크리스마스 트리 케이크 만들기 등으로 회원가입만 하면 누구나 신청 가능하다. 도에 따르면 연령대별 회원가입 비중은 50대가 22.5%로 가장 높았으며, 40대(21.6%), 60대 이상(20.1%), 30대(17.5%), 20대(16.9%) 순을 차지해..."
"'돈 잘 버는' 배달? 로켓배송 중독된 당신이 알아야 할 것 [소셜 코리아...","https://www.ohmynews.com/NWS_Web/View/at_pg.aspx?CNTN_CD=A0003087344&CMPT_CD=P0010&utm_source=naver&utm_medium=newsearch&utm_campaign=naver_news","오마이뉴스언론사 선정","대한민국 20대 사망원인 50.6%는 자살이다(통계청, 2023). 가장 자유롭고 또 왕성하게 꿈을 펼쳐야 할 시기에 혼자 세상을 뜨는 이유가 뭘까. 아마 수많은... 한술 더 떠서 자신의 소비를 이렇게 옹호하는 이들도 있다. "배달하는 사람들 돈 잘 번다. 우리가 로켓배송 안 하면 그 사람들 일자리 잃지 않느냐?" 이윤에만..."
"콘텐츠 소비 늘었다… 모바일 게임·웹툰 이용률 상승","https://www.newscj.com/news/articleView.html?idxno=3211506","천지일보","이는 굿즈 소비가 많은 10~20대와 출판만화에 익숙한 50~60대의 이용 증가가 주요 원인으로 분석됐다. 만화·웹툰 유형별 이용 경험은 포털사이트(89.1%)의 비율이 가장 높았다. 웹툰 유료 결제 경험도 전년 대비 소폭 상승해 47.2%로 나타났으며, 월평균 지출 비용은 1천~3천원 미만이 23%로 가장 높았다...."
"콘진원, 2024 콘텐츠 장르별 이용자 조사 보고서 5종 발간","https://daily.hankooki.com/news/articleView.html?idxno=1159926","데일리한국","특히 만화 이용 빈도는 10~20대의 굿즈 소비와 50~60대의 출판만화에 대한 익숙함 증대에 따라 전년 대비 2.0%p 증가한 18.3%로 나타났으며, 웹툰 이용 빈도는 전년 대비 3.9%p 증가한 66.7%로 조사됐다. 만화·웹툰 유형별 이용 경험은 포털사이트(89.1%)의 비율이 가장 높았다. 웹툰 유료 결제 경험은 47.2%로 전년..."
"경기도평생학습포털 '지식', 회원 수 400만 돌파…19일까지 온라인 이벤...","http://www.econonews.co.kr/news/articleView.html?idxno=366539","이코노뉴스","▲생성형 인공지능 강좌 ▲ 2025년 새해 계획 세우기 ▲연말정산 준비 ▲2025년 대한민국 소비 트렌드 ▲크리스마스 트리 케이크 만들기 등으로 회원가입만 하면 누구나 신청 가능하다. 경기도에 따르면 연령대별 회원가입 비중은 50대가 22.5%로 가장 높았으며, 40대(21.6%), 60대 이상(20.1%), 30대(17.5%), 20대(16.9..."
"콘텐츠 이용 빈도 증가 추세…모바일·콘솔 게임 이용률 증가","https://www.nspna.com/news/?mode=view&newsid=731808","NSP통신","특히 만화 이용 빈도는 10~20대의 굿즈 소비와 50~60대의 출판만화에 대한 익숙함 증대에 따라 전년 대비 2.0%p 증가한 18.3%로 나타났으며, 웹툰 이용 빈도는 전년 대비 3.9%p 증가한 66.7%로 조사됐다. 만화·웹툰 유형별 이용 경험은 포털사이트(89.1%)의 비율이 가장 높았다. 웹툰 유료 결제 경험은 47.2%로..."
"경기도평생학습포털 ‘지식’, 회원 수 400만 돌파","https://www.kgnews.co.kr/news/article.html?no=822651","경기신문","또 ▲생성형 인공지능 강좌 ▲ 2025년 새해 계획 세우기 ▲연말정산 준비 ▲2025년 대한민국 소비 트렌드 ▲크리스마스 트리 케이크 만들기 등 연말 맞이 맞춤형 화상 강좌도 개설했다. 연령대별 회원가입 비중은 50대가 22.5%로 가장 높았으며 40대(21.6%), 60대 이상(20.1%), 30대(17.5%), 20대(16.9%) 순으로..."
"경기도평생학습포털 '지식', 회원 수 400만 돌파","https://gg.newdaily.co.kr/site/data/html/2024/12/16/2024121600113.html","뉴데일리","△생성형 인공지능 강좌 △2025년 새해 계획 세우기 △연말정산 준비 △2025년 대한민국 소비 트렌드 △크리스마스 트리 케이크 만들기 등으로 회원가입만 하면 누구나 신청 가능하다. 연령대별 회원가입 비중은 50대가 22.5%로 가장 높았으며, 40대(21.6%), 60대 이상(20.1%), 30대(17.5%), 20대(16.9%) 순을 차지해..."
"콘진원, "모바일과 콘솔 게임 이용량 큰폭으로 놀었다"","https://www.inven.co.kr/webzine/news/?news=301744","인벤","특히 만화 이용 빈도는 10~20대의 굿즈 소비와 50~60대의 출판만화에 대한 익숙함 증대에 따라 전년 대비 2.0%p 증가한 18.3%로 나타났으며, 웹툰 이용 빈도는 전년 대비 3.9%p 증가한 66.7%로 조사됐다. 만화·웹툰 유형별 이용 경험은 포털사이트(89.1%)의 비율이 가장 높았다. 웹툰 유료 결제 경험은 47.2%로 전년..."
"2030 남성, 사춘기보다 ‘대학 입학 시기’에 스스로 외모 가꾼다","https://wemakenews.co.kr/news/view.php?no=20603","위메이크뉴스","뷰티 업계는 새롭게 소비층으로 떠오른 남성 소비자를 주목하고 있다. 대학내일20대연구소는 피부 고민이 있고 스스로 외모 관리를 하는 편이라고 인식하는 19~39세 남성을 대상으로 설문조사를 진행했다. 인포그래픽=대학내일20대연구소 제공 그 결과, 이들의 외모 관리 목적(최대 3순위)은 ‘자신감 및..."
""최근 1년간 게임 이용률 소폭 감소··· 모바일·콘솔은 증가"","https://www.getnews.co.kr/news/articleView.html?idxno=706498","글로벌경제","특히 만화 이용 빈도는 10~20대의 굿즈 소비와 50~60대의 출판만화에 대한 익숙함 증대에 따라 전년 대비 2.0%p 증가한 18.3%로 나타났으며, 웹툰 이용 빈도는 전년 대비 3.9%p 증가한 66.7%로 조사됐다. 만화·웹툰 유형별 이용 경험은 포털사이트(89.1%)의 비율이 가장 높았다. 웹툰 유료 결제 경험은 47.2%로 전년..."
"1935 여성이 지향하는 라이프스타일과 가장 잘 맞는 브랜드는 '나이키'","https://wemakenews.co.kr/news/view.php?no=20602","위메이크뉴스","라이프스타일 품목에 관심이 많은 전국 19~35세 여성 소비자 1000명을 대상으로 대학내일20대연구소가 조사한 결과, 이들이 평소 추구하는 라이프스타일에 맞춰 소비하려는 품목 1위는 의류(77.7%)였다. 이어 화장품(71.5%), 신발(59.4%) 순으로 자신의 라이프스타일을 투영하고 있었다. 인포그래픽..."
"경기도평생학습포털 '지식' 회원 수 400만 돌파···19일까지 온라인 이...","https://www.kmaeil.com/news/articleView.html?idxno=484882","경인매일","생성형 인공지능 강좌, 2025년 새해 계획 세우기, 연말정산 준비, 2025년 대한민국 소비 트렌드, 크리스마스 트리 케이크 만들기 등으로 회원가입만 하면 누구나 신청 가능하다. 연령대별 회원가입 비중은 50대가 22.5%로 가장 높았으며, 40대(21.6%), 60대 이상(20.1%), 30대(17.5%), 20대(16.9%) 순을 차지해 대체로 전..."
"'모바일 게임, 만화·웹툰·캐릭터 이용자 증가' 한국콘텐츠진흥원, 202...","https://www.lecturernews.com/news/articleView.html?idxno=168475","한국강사신문","특히 만화 이용 빈도는 10~20대의 굿즈 소비와 50~60대의 출판만화에 대한 익숙함 증대에 따라 전년 대비 2.0%p 증가한 18.3%로 나타났으며, 웹툰 이용 빈도는 전년 대비 3.9%p 증가한 66.7%로 조사됐다. 만화·웹툰 유형별 이용 경험은 포털사이트(89.1%)의 비율이 가장 높았다. 웹툰 유료 결제 경험은 47.2%로 전년..."
"경기도, 경기도평생학습포털 ‘지식’ 회원 수 400만 돌파","https://www.dailian.co.kr/news/view/1441695/?sc=Naver","데일리안","이번 개설 강좌는 생성형 인공지능 강좌, 2025년 새해 계획 세우기, 연말정산 준비, 2025년 대한민국 소비 트렌드, 크리스마스 트리 케이크 만들기 등으로 회원가입만 하면 누구나 신청할 수 있다. 연령대별 회원가입 비중은 50대가 22.5%로 가장 높았으며, 40대(21.6%), 60대 이상(20.1%), 30대(17.5%), 20대(16.9%) 순을..."
"2024 MZ세대 트렌드…달라진 금융·소비·직장문화","https://platum.kr/archives/247476","플래텀",""은행은 앱이 되고, 직장은 성장 플랫폼으로" 대학내일20대연구소가 최근 발표한 '2024 데이터 총결산' 보고서는 한국 사회의 주력 소비층으로 떠오른 MZ세대의 변화상을 보여준다. 금융생활부터 소비 패턴, 직장 문화까지 전방위적 변화가 감지된다. 특히 Z세대로 갈수록 이러한 변화는 더욱 뚜렷해지는..."
""만화·웹툰·캐릭터 이용자 증가...모바일 게임 이용률 91.7%"","https://www.digitaltoday.co.kr/news/articleView.html?idxno=545792","디지털투데이","특히 만화 이용 빈도는 10~20대의 굿즈 소비와 50~60대의 출판만화에 대한 익숙함 증대에 따라 전년 대비 2.0%p 증가한 18.3%로 나타났으며, 웹툰 이용 빈도는 전년 대비 3.9%p 증가한 66.7%로 조사됐다. 만화·웹툰 유형별 이용 경험은 포털사이트(89.1%)의 비율이 가장 높았다. 웹툰 유료 결제 경험은 47.2%로..."
"웹툰·캐릭터 이용자 증가…콘진원, 장르별 조사보고서 발간","https://www.widedaily.com/news/articleView.html?idxno=254063","와이드경제","특히 만화 이용 빈도는 10~20대의 굿즈 소비 등으로 인해 전년 대비 2.0%포인트(p) 증가한 18.3%로 나타났다. 웹툰 이용 빈도는 전년 대비 3.9%p 증가한 66.7%로 조사됐다. 만화·웹툰 유형별 이용 경험은 포털사이트(89.1%)의 비율이 가장 높았다. 웹툰 유료 결제 경험은 47.2%로 전년 대비 소폭 상승했다. 월평균..."
"경기도평생학습포털 '지식', 회원 수 400만명 돌파","https://www.pressian.com/pages/articles/2024121610252078023?utm_source=naver&utm_medium=search","프레시안","△생성형 인공지능 강좌 △2025년 새해 계획 세우기 △연말정산 준비 △2025년 대한민국 소비 트렌드 △크리스마스 트리 케이크 만들기 등으로 회원가입만 하면 누구나 신청 가능하다. 연령대별 회원가입 비중은 50대가 22.5%로 가장 높았으며, 40대(21.6%), 60대 이상(20.1%), 30대(17.5%), 20대(16.9%) 순을 차지해..."
"대학내일, 세대별 주요 데이터 공개···소비·식생활·직장·가치관 등","http://www.financialreview.co.kr/news/articleView.html?idxno=32142","파이낸셜리뷰","#2030 남성, 사춘기 때보다 '이 시기'에 스스로 외모 가꾼다 뷰티 업계는 새롭게 소비층으로 떠오른 남성 소비자를 주목하고 있다. 대학내일20대연구소는 피부 고민이 있고 스스로 외모 관리를 하는 편이라고 인식하는 19~39세 남성을 대상으로 설문조사를 진행했다. 그 결과, 이들의 외모 관리 목적(최대..."
"Both parties must unite during a national crisis (KOR)","https://koreajoongangdaily.joins.com/news/2024-12-16/englishStudy/bilingualNews/Both-parties-must-unite-during-a-national-crisis-KOR/2201495","코리아중앙데일리","윤 대통령은 20대 대선에서 이재명 더불어민주당 후보에게 고작 0.73%포인트 앞섰지만 권력은 100%를 쥐었다. 이 후보의... 또 탄핵 사태의 여파로 연말 소비가 위축될 것이라는 우려가 적잖다. 과도한 불안심리를 다독이면서 거시경제를..."
"콘진원, 2024 콘텐츠 장르별 이용자 조사 보고서 5종 발간","https://www.khgames.co.kr/news/articleView.html?idxno=235226","경향게임스","특히 만화 이용 빈도는 10~20대의 굿즈 소비와 50~60대의 출판만화에 대한 익숙함 증대에 따라 전년 대비 2.0%p 증가한 18.3%로 나타났으며, 웹툰 이용 빈도는 전년 대비 3.9%p 증가한 66.7%로 조사됐다. 만화·웹툰 유형별 이용 경험은 포털사이트(89.1%)의 비율이 가장 높았다. 웹툰 유료 결제 경험은 47.2%로 전년..."
"경기도평생학습포털 '지식' 회원 수 400만 명 돌파","https://news.tf.co.kr/read/national/2161550.htm","더팩트","대한민국 소비 트렌드 △크리스마스 트리 케이크 만들기 등 맞춤형 화상 강좌도 개설했다. 강좌는 회원가입만 하면 누구나 신청이 가능하다. 연령대별 회원가입 비중은 50대가 22.5%로 가장 높았다. 이어 40대(21.6%), 60대 이상(20.1%), 30대(17.5%), 20대(16.9%) 순을 차지해 대체로 전 연령대에서 고르게 이용하는..."
"2024년, 게이머는 줄었지만 게임시간은 늘었다... 한국콘텐츠진흥원, 콘...","http://gamefocus.co.kr/detail.php?number=161823","게임포커스","특히 만화 이용 빈도는 10~20대의 굿즈 소비와 50~60대의 출판만화에 대한 익숙함 증대에 따라 전년 대비 2.0%p 증가한 18.3%로 나타났으며, 웹툰 이용 빈도는 전년 대비 3.9%p 증가한 66.7%로 조사됐다. 만화·웹툰 유형별 이용 경험은 포털사이트(89.1%)의 비율이 가장 높았다. 웹툰 유료 결제 경험은 47.2%로 전년..."
"대세는 모바일게임, 이용률 91.7%…PC게임 하락세","https://view.asiae.co.kr/article/2024121609435858431","아시아경제","10~20대의 굿즈 소비 등에 힘입어 지난해보다 2.0%P 오른 18.3%를 기록했다. 웹툰도 3.9%P 증가한 66.7%로 조사됐다. 만화·웹툰 유형별 이용 경험에선 포털사이트(89.1%) 비율이 가장 높았다. 웹툰 유료 결제 경험은 47.2%로, 지난해보다 소폭 늘었다. 월평균 지출 비용은 1000~3000원 미만이 23%로 가장 높았다...."
"[핫클릭] 대통령실 인근 윤 대통령 응원 화환에 불…경찰 조사 外","http://www.yonhapnewstv.co.kr/MYH20241216004400641/?input=1825m","연합뉴스TV언론사 선정","▶ 'K팝에 응원봉까지'…새 집회 문화 이끄는 1020 여성 지난 6일부터 국회 앞에서 매일 열린 집회 현장에 10~20대 여성이 주축으로 떠오르고 있습니다.... 최근 SNS 등에는 아이유 광고모델로 활동하고 있는 기업과 제품 목록을 공유하고 소비하지 말자는 글이 공유되고 있습니다. 이런 소식이 알려지자 탄핵 집회..."
"이마트24, 대한결핵협회와 크리스마스 씰 모금 캠페인 진행","http://theviewers.co.kr/View.aspx?No=3481696","뷰어스","물론 20대~30대까지 팬층을 보유한 국내 인기 애니메이션인 ‘브레드이발소’ 캐릭터를 선정했다.브레드이발소 크리스마스 씰은 과거 우표형 씰이... 모금활동 확산에 기여할 수 있길 바란다”며 “앞으로도 경영주, 고객들과 함께 착한 소비를 이어갈 수 있는 상품을 기획해 나갈 계획이다”고 말했다."
"콘진원, 2024 콘텐츠 장르별 이용자 조사 보고서 5종 발간","http://www.newsworker.co.kr/news/articleView.html?idxno=360280","뉴스워커","특히 만화 이용 빈도는 10~20대의 굿즈 소비와 50~60대의 출판만화에 대한 익숙함 증대에 따라 전년 대비 2.0%p 증가한 18.3%로 나타났으며, 웹툰 이용 빈도는 전년 대비 3.9%p 증가한 66.7%로 조사됐다. 만화·웹툰 유형별 이용 경험은 포털사이트(89.1%)의 비율이 가장 높았다. 웹툰 유료 결제 경험은 47.2%로 전년..."
"[인더필드] 스페셜티 커피 맛의 향연…이디야 커피 다이닝 ‘커마카세’","https://www.inthenews.co.kr/news/article.html?no=67605","인더뉴스","한국 성인의 연간 평균 커피 소비량은 세계 2위(405잔)로 전 세계 평균(152잔)의 두 배가 넘습니다. 지난해 국내 커피 시장 규모는 약 8조6000억원으로 미국... 주요 고객층은 생일이나 기념일에 찾는 커플 고객부터 커피업계 종사자, 지방에서 올라온 4인 가족 등 20대부터 40대까지 다양합니다. 남자들끼리 오거나..."
