Title,Link,Press,Description
"“메신 오셨다” 400만명 뛰쳐나왔다","https://www.joongang.co.kr/article/25127693","중앙일보","지난달 소비자 물가는 전년 대비 92.4%가 올랐다. 이 어려운 시기에 메시가 월드컵 우승과 함께 ‘할 수 있다’는 희망을 줬다. 지금 아르헨티나... 영국 데일리 메일은 “행사 도중 건물 지붕 위에 올라가 선수단을 환영하던 20대 남성이 추락하면서 사망했다”고 전했다. 아르헨티나 선수들은 안전에..."
"용산 시대·중꺾마·우영우…키워드로 돌아본 2022년","https://www.mk.co.kr/article/10571010","매경이코노미언론사 선정","결국 윤석열 후보가 48.5%를 획득, 이재명 후보를 약 0.7% 차이로 누르고 대한민국 20대 대통령으로 당선됐다. 정권이 바뀌면서 정책과 제도 등에서 많은... 이에 한국은행의 점진적 금리 인상 속도 조절, 정부의 수출 증대와 소비·투자 활성화 노력 등을 주문하는 목소리가 나온다. 실제 코스피지수에서는 경기..."
"“고작 900원 아끼자고 이렇게까지” 20대 여성 ‘짠내 생활’ 이 정도...","http://news.heraldcorp.com/view.php?ud=20221221000732","헤럴드경제언론사 선정","20대 직장인 A씨는 최근 들어 기프티콘 중고거래 플랫폼을 밥 먹듯 드나든다. 플랫폼을 통해 기프티콘을 거래하면 쿠폰 종류와 브랜드에 따라 백원... 합리적 소비를 찾는 사용자가 늘자 기프티콘 중고거래 시장이 성장하고 있다. 2021년 1월과 2022년 11월 사이 국내 주요 기프티콘 중고거래 플랫폼의 월간..."
"소비자원 "70세 이상 디지털 거래역량 31점"","https://www.idaegu.co.kr/news/articleView.html?idxno=405197","대구신문","이 밖에도 20대의 소비자 재무 역량은 64.4점으로 60대(65.7점)보다 낮고 70세 이상(61.3점)과도 비슷한 수준이어서, 20대 소비자의 재무역량 개선 여지가 있었다. 소비자원은 "이번 조사를 소비자 정책 기본 계획 수립에 활용할 계획"이라고 밝혔다."
""버겁다"… 청년들에 더 가혹한 高물가","http://www.cctimes.kr/news/articleView.html?idxno=732798","충청타임즈","한국은행에 따르면 올해 소비자물가 상승률은 24년 만에 최고치를 찍었다. 소비자물가지수는 지난달까지 월 평균 5%대 상승률을 보였다. 난방비... 상황이 이렇다 보니 소득이 적은 20대 청년들은 생활비 부담에 허리가 휠 수밖에 없다. 전국경제인연합회에서 발표한 `세대별 체감경제고통지수'에 따르면..."
"전세사기에 공인중개사·건축주까지 가담...국토부, 사례 106건 수사 의...","https://thepublic.kr/news/view/1065602868947089","더퍼블릭","피해액은 171억원을 초과할 것으로 추정되는데, 20대와 30대가 각각 17.9%, 50.9%로 가장 많았다. 이어 40대 11.3%, 50대는 6.6%를 차지했다. HUG... 국토부는 1차로 전세 사기 사례 수사 의뢰와 동시에 오는 27일 부동산소비자 보호 기능의 강화를 위해 기존 ‘부동산거래분석기획단’을 ‘부동산소비자보호기획단’..."
"[아듀! 2022]① 올 한해 기억에 남는 국내 분야별 10대 키워드","http://www.thedailypost.kr/news/articleView.html?idxno=90678","데일리포스트","인류 사회에 깊숙이 동화된 코로나-19 펜데믹과 과잉 유동성, 물류대란, 소비 과열, 여기에 러시아의 우크라이나 침공 등 복합적인 구조가 결국 글로벌... " (윤석열 대통령 지난 대선 당시 환경 공약 中) 20대 대통령 후보 시절 '실효적인 온실가스 감축과 기후위기 적응대책을 적극 추진해 원자력과..."
"교보문고 2022년 베스트셀러 결산","http://kookbang.dema.mil.kr/newsWeb/20221222/11/ATCE_CTGR_0060010000/view.do","국방일보","코로나19 여파는 여전했고 소비의 무게중심은 오프라인에서 온라인으로 옮겨 갔다. 책에 관한 관심이 커진 시기이기도 했다. 더 나은 삶에 대한 갈망이... 않는다』는 20대 독자에게 가장 사랑받았다. 이 밖에 인문 분야는 전년 대비 소폭 상승했고 자기계발은 하락세를 보였다. 에세이 역시 2010년대 이후..."
"'조용한 사직'에 맞서는 '조용한 해고' 정답은?","http://www.ekoreanews.co.kr/news/articleView.html?idxno=64477","이코리아","미국 뉴욕의 20대 엔지니어인 자이들 플린이 틱톡 계정을 통해 "일이 곧 삶이 아니다. 당신의 가치는 당신의 성과로 결정되는 게 아니다."라고 말한... 김난도 서울대 소비자학과 교수도 '트렌드코리아 2023' 출간 간담회에서 조용한 사직을 내년 대한민국을 관통하는 주요 키워드로 꼽으면서 "젊은 세대의 근무..."
""극장표 이렇게 비쌌나?”...웃돈 중고거래까지","https://zdnet.co.kr/view/?no=20221219102728","지디넷코리아언론사 선정","소비자 피해가 우려된다는 지적이 나온다. 직장인 김 모(20대) 씨는 "1인 영화표값이 거의 밥값보다 비싸져서 1년에 한 두번 보면 많이 보는 수준으로 소비패턴이 바뀌었다"고 말했다. 또 다른 직장인 이 모(30대) 씨도 "주말에 여자친구와 영화를 볼려고 예매하려 했는데, 인기 영화는 거의 대부분 매진..."
"물가 상승률에도 못미치는 5대은행 퇴직연금 수익률 '고작 1%대'","http://www.thekpm.com/news/articleView.html?idxno=141334","포인트데일리","지난해 소비자물가상승률(2.5%)을 고려하면 사실상 손해를 본 셈이다. 최근 5년간 다른 주요 연금의 연평균 수익률은 국민연금 7.63%, 공무원연금 7.20... 20대 국민연금 가입자들이 노후에 국민연금을 받을 수 있을지 알 수 없다. 공적 연금만으로 노후 소득 달성이 어렵다는 전망은 어제 오늘 일이..."
"hy(옛 한국야쿠르트), 잇츠온 샐러드 연간 판매량 100만개 돌파","https://www.mhns.co.kr/news/articleView.html?idxno=543770","문화뉴스","2021년 대비 20대 구매 비율은 2% 늘었다. 물가상승이 본격화된 5월 판매량은 14만 개로 자체 월 판매량 최대치를 경신했다. 5월부터 7월까지 3개월간 판매량은 전년 같은 기간과 비교해도 30% 이상 늘었다. 소비자물가 동향에 따르면 7월 신선식품지수는 동기 대비 13% 올랐다. 폭염과 폭우로 인하여 채소, 과일..."
"[JOB인터뷰] 분아카데미 윤혁진 대표, "음악이 선물하는 강렬한 에너지...","http://www.sisunnews.co.kr/news/articleView.html?idxno=175703","시선뉴스","언제나 그랬듯이 많은 대중이 요구하고 소비한다면 매체도 조금씩 변화하면서 작은 공연이 아닌 큰 공연에서 만날 수 있을 것이라 생각한다. 성공한... 20대 중반부터 작곡 강사로 활동하며 학원, 주민센터, 초중고, 대학교 강의까지, 다양한 연령대를 만나 각 연령층과 목적에 필요한 수업 연구를 꾸준히 기록해..."
"네이버 프리미엄콘텐츠의 고퀄리티 콘텐츠로 ‘풍성한 연말’","http://www.segye.com/content/html/2022/12/21/20221221506314.html?OutUrl=naver","세계일보","네이버 프리미엄콘텐츠에 따르면 경제/비즈니스(39%), 재테크(28%), 부동산(13%) 주제의 콘텐츠가 인기가 높으며, 구독자들은 평균 주 3회 이상 방문해 5분 이상 콘텐츠를 소비하고 있다. 구독자 비율은 30대(34%), 40대(31%), 20대(15%) 순으로, 유료 구독 서비스에 익숙한 MZ 세대 비중이 높은 것으로 나타났다. 네이버..."
"1초에 10그릇 팔린 동지팥죽...MZ세대도 '팥죽'에 푹 빠졌다","http://www.thekpm.com/news/articleView.html?idxno=141313","포인트데일리","일 년 중 밤이 가장 길다는 동지를 하루 앞두고 팥이 들어간 제품들이 소비자의 뜨거운 관심을 모으고 있다. 사진=연합뉴스 "올해는 동지팥죽을 꼭 먹을 거예요. 요즘은 즉석죽도 통팥이 살아있는 제품이 많아 간편하게 즐길 수 있어 좋아요." 20대 대학생 정모씨는 "시중에서 파는 팥죽은 너무 달아 거부감이..."
"포켓몬빵 대란부터 푸르밀의 위기까지 [22년 10대 뉴스-식품·외식]","http://www.sisaon.co.kr/news/articleView.html?idxno=145923","시사오늘","ⓒ사진 제공=뉴시스 2022년 식품·외식업계는 길었던 사회적 거리 두기와 작별하면서 경기 회복을 기대했지만, 고물가 속 얼어붙은 소비심리를... 10월엔 SPC그룹 계열 SPL 공장에서 20대 근로자의 끼임 사망사고가 발생했다. 허영인 SPC 그룹 회장이 대국민 사과를 하고 안전경영 대책을 발표했다. 11월엔 농심..."
"[전병서 스페셜 칼럼] '차이나 런'? …색안경 벗으면 보이는 것들","https://www.ajunews.com/view/20221219142113040","아주경제","중국의 20대 당대회와 오미크론 2차확산을 계기로 '차이나 런(china run)'이란 용어가 많이 등장하고 있다. '차이나 런'은 중국 회피와 차이나 뱅크런의... 중국 소비자는 이미 가성비 시대의 한류는 잊은 지 오래다. 1인당소득 1만2000달러대의 나라지만 전 세계 명품의 35%를 사들이고 전 세계 벤츠의 36%를..."
"박윤규 과기정통부 2차관, 데이터 산업 분야 혁신기업 시상 및 격려","http://www.boannews.com/media/view.asp?idx=112760&kind=","보안뉴스","고도화로 소비자의 편의성을 제고한 ‘파인더스 에이아이’, 폐쇄회로텔레비전 영상데이터 분석 인공지능모형 정확도 개선으로 공공 및 산업 현장에서... 가명·익명 처리기술 발굴 및 저변 확대에 기여한 ‘성동구소재회사근무중인20대남성개발자4명’과 ‘장노니머스’가 과기정통부 장관상을 수상했으며..."
"40년된 성경김에 20대들 열광 대표 K푸드로 해외서도 러브콜","https://www.mk.co.kr/article/10576926","매일경제","젊은 소비자 반응을 이끌어 내면서 인지도를 높였다"고 말했다. 1981년 대전의 한 재래시장에서 작은 김 가게로 시작한 성경식품은 재래시장 등 골목상권... 임 대표는 "성경김은 동네 슈퍼마켓과 재래시장 쪽에서 독보적인 강자였지만 소비 연령대가 높아 미래의 고객을 확보해야 한다고 생각했다"고..."
"이랜드, 젊어진 이랜드, 여성 SPA '미쏘' 앞세워 MZ 사로잡다","https://www.mk.co.kr/article/10576918","매일경제","미쏘는 온라인 공략을 위해 10·20대 여성 소비자의 온라인 쇼핑 수요를 철저히 분석했다. 특히 지그재그와 협업해 젊은 여성의 쇼핑 데이터를 분석하고 발 빠른 상품 기획을 통해 해당 소비자를 겨냥한 '캐리오버(시즌과 관계없이 계속 잘 팔리는 브랜드의 시그니처 패션 아이템)' 상품을 만들어낸 것이..."
"[기업, 기업인!] <21>이광옥 반도 회장","https://www.imaeil.com/page/view/2022121618193420612","매일신문","우리나라 20대 수출 품목 중 '플라스틱 제품 및 석유화학 제품' 수출액은 반도체에 이어 2위에 해당할 만큼 플라스틱은 비중이 큰 산업 분야다. 국내... 플라스틱 필름은 소비재 포장은 물론 산업 전반에 광범위하게 쓰인다. 반도가 생산하는 제품만 해도 산업 포장용 PE·PS필름, 전자제품·식품 포장용 필름..."
"'빌라왕' 피해 지원 TF 출범…전세사기 106건 수사 의뢰","http://www.yonhapnewstv.co.kr/MYH20221221010500641/?input=1825m","연합뉴스TV","30대와 20대가 대부분을 차지했다고 들었습니다. 이 원인은 어디에 있다고 보십니까? <질문 5> 특히 이번 조사는 현재 단장님이 맡고 계신 부동산거래분석기획단을 중심으로 이뤄진 것으로 알고 있는데요. 향후에는 부동산소비자 보호 기획단으로 개편할 계획이라고 알고 있는데, 기존의 기획단과는 어떤..."
"청년들, 카타르 월드컵 더 다양하고 유쾌하게 봤다","http://www.idomin.com/news/articleView.html?idxno=813201","경남도민일보","이러한 밈을 만들고 적극적으로 활용하는 20대들은 이번 월드컵을 어떻게 관람했을까. 이들이 월드컵을 즐기고 소비하는 방식을 들여다 봤다. 경기 관람 문화는 대체로 기존 월드컵과 비슷했다. 대학생 김채영(20) 씨는 주로 친구들과 학교 근처 술집에서 월드컵 경기를 봤다. 김 씨는 "많은 사람과 월드컵을..."
"[2022결산-증권①]"극악의 난이도" 동학개미 주식시장 대거 이탈","http://www.mediapen.com/news/view/780023","미디어펜","윤석열 제20대 대통령이 5월 취임하며 새 시대에 대한 기대감을 자아냈지만 한 번 형성된 하락추세를 반전시킬 수는 없었다. 주식투자 자체에 대한... 투자자들은 제롬 파월 연준(Fed) 의장의 ‘입’은 물론 매월 발표되는 미국 소비자물가지수(CPI)가 국내외 주가지수에 엄청난 파장을 야기하는 모습을 몇..."
"오후석 경기도 행정2부지사 취임 "경기북부특별자치도 추진 최선 다할 ...","http://www.consumernews.co.kr/news/articleView.html?idxno=666583","소비자가 만드는 신문","오후석 행정안전부 생활안전정책관이 경기도 제20대 행정2부지사로 취임했다. 오후석 신임 경기도 행정2부지사는 21일 북부청사에서 취임식을 진행한... 등을 역임하며 중앙과 지방행정경험을 쌓았다. 우수공무원에게 주어지는 2019년 홍조근정훈장과 2004년 대통령 표창을 받았다. [소비자가만드는신문=]"
"밀리의서재, ‘밀리 독서 리포트 2022′ 발간…올해 키워드는 ‘과몰입...","https://biz.chosun.com/it-science/ict/2022/12/21/VFYU62FLTZBJBDXBLHOLCPYAXY/?utm_source=naver&utm_medium=original&utm_campaign=biz","조선비즈","연령별로는 20대와 30대가 각각 31.8%와 25.3%를 기록했다. 전체적인 서비스 이용 시간은 작년과 비슷했고, 책을 가장 많이 읽은 시간은 밤 9시에서 10시... 밀리의 서재는 ‘밀리 독서 리포트’를 통해 올해 사랑받은 장르와 소재, 포맷, 콘텐츠 소비 특징을 공개했다. 2022년에는 대중들이 흡인력 있는 스토리에..."
""소외받던 이들이 주류로", 2023 소비 트렌드 키워드 살펴보기","http://www.dailypop.kr/news/articleView.html?idxno=65322","데일리팝","각각 20대는 17.7%, 30대는 20.1%, 40대 11.1%, 50대 12.9%, 60대 13.7%로 나타났다. 'T': 컬러풀 소사이어티(Think of Colorful Society) '컬러풀 소사이어티' 소수 집단이 새로운 소비 계층으로 여겨지며, 개개인의 특성을 다채로운 컬러로 이해하는 사회적 분위기가 형성되고 있음을 뜻한다. 일례로 '먹방'이..."
"부동산 전세사기 의심거래 106건 경찰 수사의뢰","http://www.kidd.co.kr/news/230650","산업일보","전세사기 의심거래의 피해액은 171억 원 이상으로 추정되며, 피해자는 30대(50.9%)와 20대(17.9%)가 주를 이루었고, 40대(11.3%), 50대(6.6%)가 그 뒤를 이었다. 이달 27일에는 부동산소비자 보호기능 강화를 위해 기존 '부동산거래분석기획단'을 '부동산소비자보호기획단'으로 개편한다. 그간 기획단은 주택시장 안정과..."
"[인터뷰]"데코라존 윈·윈터 페스티벌 참여해 '의견 교류의 장' 됐다"","https://www.asiatoday.co.kr/view.php?key=20221220010009935","아시아투데이","김성규 데코라존 대표는 21일 아시아투데이와 인터뷰를 통해 "20대에서 30대, 주로 여성 고객이 우리 제품을 많이 찾는다"며 "이런 타깃을 목표로 브랜드... 한편 한겨울의 동행축제 윈·윈터 페스티벌은 코로나19와 경기침체로 어려움을 겪는 중소·소상공인을 응원하고자 중소벤처기업부에서 주최한 연말 소비..."
"[데일리 IT 단신] KT '메타라운지', 기업·기관 메타버스 시장 공략 外","https://biz.newdaily.co.kr/site/data/html/2022/12/21/2022122100095.html","뉴데일리","경제·비즈니스(39%), 재테크(28%), 부동산(13%) 주제 순으로 인기가 높으며, 구독자들은 평균 주 3회 이상 방문해 5분 이상 콘텐츠를 소비했다. 구독자 비율은 30대(34%), 40대(31%), 20대(15%) 순으로 유료 구독 서비스에 익숙한 20-40 세대 비중이 높았다. 네이버 프리미엄콘텐츠는 2월 오픈 플랫폼으로 전환하며 누구나..."
""대통령 문재인이 이루고 싶었던 대한민국" 전문기자 이필재 외 공동저...","https://www.lecturernews.com/news/articleView.html?idxno=114879","한국강사신문","응원하는 20대의 홀로서기》, 《진보적 노인》 등 10권의 책을 냈다. 저자 김규철은 서강대에서 사학을, 연세대 행정대학원에서 사회복지를 전공했다.... 중국 《인민일보》 해외판 한국대표처 편집위원, 《금융소비자뉴스》 편집위원 등을 역임했다. 현재 'GK부동산경제연구소' 대표로 '아파트값 연간 상승률..."
"국토부, '빌라왕' 포함 전세사기 106건 적발 수사의뢰","https://realty.chosun.com/site/data/html_dir/2022/12/21/2022122101083.html","땅집고","피해자는 사회초년생과 신혼부부로 추정되는 30대(50.9%)와 20대(17.9%)가 많았다. 국토부는 오는 27일 부동산소비자 보호기능을 강화하기 위해 기존 부동산거래분석기획단을 부동산소비자보호기획단으로 개편할 방침이다. 기획단은 주택시장 안정과 공정한 거래질서 확립을 위해 부동산 계약 단계에 초점을..."
"빌라왕에겐 확정일자·전입신고도 소용없어… 줄줄이 전세금 떼인다","http://www.seoulwire.com/news/articleView.html?idxno=489841","서울와이어","30대는 50.9%, 20대는 17.9%를 차지했다. 이들이 전사세기로 당한 피해금은 171억원에 달하는 것으로 추정된다. 국토부는 1차 수사 의뢰 사건에 포함되지 않은 나머지 피해 사례도 조사·분석해 추가로 수사 의뢰할 계획이다. 아울러 국토부는 오는 27일 부동산소비자 보호 기능 강화를 위해 기존..."
"케이크 성수기 성탄절인데...SPC 불매운동 재점화 조짐?","http://www.issuenbiz.com/news/articleView.html?idxno=19455","이슈앤비즈","SPC 불매운동은 10월 15일 20대 노동자가 SPC 계열사인 SPL 제빵공장에서 안전장치도 없이 소스 교반기를 가동하다 끼임 사고로 사망하는 일이 벌어지며... 이은희 인하대 소비자학과 교수는 노동자 사망 사고 이후 한 달간 이어진 불매운동의 불씨가 여전히 살아있는 상태라고 진단했다. 이 교수는 "크리스마스..."
""네이버와 함께 2022년 마무리하세요~"…풍성한 연말 서비스 제공","http://www.sentv.co.kr/news/view/640717","서울경제TV","네이버 프리미엄콘텐츠에 따르면 경제/비즈니스(39%), 재테크(28%), 부동산(13%) 주제의 콘텐츠가 인기가 높으며, 구독자들은 평균 주 3회 이상 방문해 5분 이상 콘텐츠를 소비하는 것으로 나타났다. 구독자 비율은 30대(34%), 40대(31%), 20대(15%) 순으로, 유료 구독 서비스에 익숙한 MZ 세대 비중이 높았다...."
"케이크 성수기 성탄절 앞두고 SPC 불매 다시 '꿈틀'","https://www.yna.co.kr/view/AKR20221220147600004?input=1195m","연합뉴스언론사 선정","SPC 불매운동은 10월 15일 20대 노동자가 SPC 계열사인 SPL 제빵공장에서 안전장치도 없이 소스 교반기를 가동하다 끼임 사고로 사망하는 일이 벌어지며... 이은희 인하대 소비자학과 교수는 노동자 사망 사고 이후 한 달간 이어진 불매운동의 불씨가 여전히 살아있는 상태라고 진단했다. 이 교수는 "크리스마스..."
"카카오 ‘사업 접고’, 네이버 ‘서비스 늘리고’…구독 서비스 시장 생...","https://economist.co.kr/2022/12/21/it/general/20221221100957413.html","이코노미스트언론사 선정","개인 맞춤형 서비스로 진화…제휴사 확보가 경쟁력 소비자들이 이용하는 유료 구독 플랫폼은 이에 따라 그 개수가 증가하는 추세다.... 지난 9월에는 20대 사용자들이 활발하게 사용하는 교육·게임·카메라앱 등을 혜택에 추가한 ‘네이버플러스 멤버십 스튜던트’도 출시한 바 있다. IT업계 관계자는..."
"[스프] 나는 오늘, 낫을 든 사람을 만나러 간다","https://news.sbs.co.kr/news/endPage.do?news_id=N1007014916&plink=ORI&cooper=NAVER","SBS","실제로 나도 쿠팡에 내 모든 소비생활을 완전히 맡긴 지 오래다. 주기적으로 사야 하는 생필품뿐 아니라 유행에 맞는 옷이나 작은 액세서리, 그리고... 환갑을 앞둔 나이에 탈모가 와서 머리를 밀었어도 여전히 20대 아이돌 뺨칠 정도의 미모이긴 하지. 그 사람이 마지막으로 찍은 영화가 아저씨였던 것 같은데. 그..."
"네이버 프리미엄콘텐츠, 구독자 65%가 30·40대...경제·비즈니스 인기 ...","https://www.ajunews.com/view/20221221092507342","아주경제","그 뒤를 전체 15%를 차지한 20대가 이었다. 콘텐츠 테마 중에서는 경제·비즈니스 콘텐츠에 대한 선호도가 전체 39%로 가장 높은 것으로 나타났다. 그 뒤를 재테크(28%), 부동산(13%)이 이었다. 구독자들은 평균 주 3회 이상 방문해 5분 이상 콘텐츠를 소비하는 것으로 조사됐다. 올해 2월 오픈 플랫폼으로..."
"국내 '소비자역량' 30대가 가장 높아","https://kizmom.hankyung.com/news/view.html?aid=202212210253o","키즈맘","또한 20대의 소비자재무역량(64.4점)은 60대(65.7점)보다도 낮고, 70세 이상(61.3점)과도 큰 차이가 나지 않아, 20대 소비자의 재무역량 개선도 추진할 필요가 있다. 소비자역량 향상이 필요한 목표 정책 대상과 영역을 도출하기 위해 소비자역량 수준을 5구간으로 나눠 분석한 결과, 60대와 70세 이상의..."
""추리·스릴러 소설 압도적으로 많이 읽었다"","http://www.munhaknews.com/news/articleView.html?idxno=71142","문학뉴스","콘텐츠 소비 특징을 공개했다. '밀리 독서 리포트'는 1월부터 10월까지 밀리의 서재 회원들 독서 데이터를 사회문화적 맥락에서 해석한 자료로, 2020년부터 해마다 발간하고 있다. 2022년 밀리의 서재 이용자 특성을 살펴본 결과, 성별로는 여성이 57.8%, 남성이 42.2%로 여성 비중이 다소 높았다. 연령별로는 20대와..."
"[이색사회공헌] “연말을 경계하라” 음주운전과의 전쟁 나선 오비맥주","https://www.cnbnews.com/news/article.html?no=579129","CNB뉴스","지난 6월에는 오비맥주 공장에서 전국의 직매장으로 맥주를 배송하는 화물차량 20대, 9월에는 본사 임직원 차량 20대에 음주운전방지장치(Ignition Interlock... 생산·포장·운반·소비…전 과정 ‘친환경’ 오비맥주는 ESG의 핵심 키워드 중 하나인 환경 문제에도 적극적이다. 4대 친환경경영 과제로 ▲기후변화..."
"밀리의 서재, 빅데이터 기반 '밀리 독서 리포트 2022' 발간","https://www.ebn.co.kr/news/view/1559908/?sc=Naver","EBN","연령별로는 20대와 30대가 각각 31.8%, 25.3%를 기록했다. 전체적인 서비스 이용 시간은 전년과 유사했고, 책을 가장 많이 읽은 시간은 밤 9~10시인 것으로 나타났다. 밀리의 서재는 밀리 독서 리포트를 통해 올해 사랑받은 장르와 소재, 포맷, 콘텐츠 소비 특징을 공개했다. 올해에는 추리·스릴러 장르가 큰인기를..."
"코로나19로 침체됐던 ‘이 시장’…엔데믹에 수요 폭발","https://www.mk.co.kr/article/10575430","매일경제언론사 선정","실제 전시 티켓 예매자 중 20대가 39.7%로 가장 많았다. 이어 30대 31.0%, 40대 18.8%, 50대 이상 8.4%, 10대 2.1% 등 순이었다. 남녀 비중은 여성이 74.9%로 남성... 회복되고 있다”며 “연말·연초 공연 상품을 찾는 소비자를 위해 장르와 연령대별 인기 공연을 지속적으로 큐레이션 해 선보일 예정”이라고 말했다."
"[이슈분석] 커지는 경기 침체 '경고음'…움츠린 기업에 '고용 한파'","https://biz.sbs.co.kr/article_hub/20000094620?division=NAVER","SBS Biz언론사 선정","- 이창용 "11월 최종금리 수준 3.5% 정책 약속 아냐" - 한은, 내년 물가 '상고하저' 전망…"높은 수준 지속" - 소비자물가 당분간 5% 내외 전망…오름세는 둔화... - 20대 기업 중 17곳 조업 축소…5대 은행 2,400명 감원 - 유화업계 가동률 20%대 급락…가전업계 영업익 '뚝' - 금융권부터 스타트업·유통업까지 전방위적..."
"코지마, 연말맞아 의왕시 노인복지관에 안마의자 기부","https://www.etnews.com/20221221000001","전자신문","코지마는 소비자중심경영(CCM)의 일환으로 다양한 사회공헌 활동을 전개 중이다. 2018년부터 전속 모델 장윤정과 함께 전국 경로당을 직접 방문해... 안마의자 20대를 기부했다. 김경호 마케팅부 본부장은 “연말을 맞아 노인 일자리와 사회활동 지원 사업에 앞장서고 있는 의왕 노인복지관에 안마기기를..."
