Title,Link,Press,Description
"팬데믹 이후 해외 관광청, 한국 관광객 유치 잰걸음","https://www.nocutnews.co.kr/news/5864638","노컷뉴스","한국의 관광산업에 대한 컨트롤타워가 없다보니 여행수지는 여행소비자들의 움직임만 지켜보는 수준이다. 실제로 국내 여행수지는 해마다 적자다.... 윤석열 대통령도 제20대 대통령 공약으로 문화체육관광부내 관광국을 독립된 외청으로 승격한 '관광청'을 설립하고 제주배치 계획을 발표했다. 하지만..."
"[대일논단] 월드컵 속 슬픔","http://www.daejonilbo.com/news/articleView.html?idxno=2038720","대전일보","축구공의 생산과 소비 역시 불평등을 보여준다. 전 세계 축구공의 2/3 이상은 파키스탄 북동쪽 한 도시에 있는 약 1000개의 공장에서 만들어진다. 말이... 지난 9월 이란에서는 한 20대 여성이 히잡을 제대로 쓰지 않았다는 이유로 소위 '도덕 경찰'에 의해 체포되어 의문사를 당했다. 물론 이란의 여성에 대한..."
"[굿모닝브리핑] 택시 심야할증 인상...공급은 늘고 수요는 줄었다","https://www.ytn.co.kr/_ln/0103_202212150659525915","YTN","느끼는 소비자가 많아졌다고 합니다. 그래서 연말 모임을 갖더라도1차에서 마무리하고,일찍 귀가하는 경우가 많아졌다고 하는데요. 대표 택시 호출 앱... [이현웅] 틱톡은 10대와 20대를 중심으로 상당히 미국에서 많이 사용하고 있는 앱인데 한국일보 기사를 보면 최근 미국 상, 하원에서틱톡을 미국에서 전면..."
"글로벌 규범 된 ESG…규제화 급물살","https://magazine.hankyung.com/business/article/202212068812b","한경비즈니스언론사 선정","국내 삼성전자·현대차도 RE100 참여 한국 최대 전력 소비 기업인 삼성전자도 RE100(기업이 사용하는 전력 100%를 재생에너지로 충당하겠다는 캠페인)에... 최근 작업 중 끼임 사고로 20대 노동자 사망 사고가 있었던 SPC그룹, 경기도 의왕시 오봉역에서 작업 중이던 직원 사망 사고가 발생한 한국철도공사..."
"美 최악 금융사기 FTX, 배후엔 ‘파워 엘리트’ 부모","https://www.chosun.com/international/us/2022/12/15/HPEKW57NXFDWTE4JVXG3BTAYPI/?utm_source=naver&utm_medium=referral&utm_campaign=naver-news","조선일보","20대인 샘 뱅크먼프리드는 2020년 대선 당시 조 바이든 대통령에게 개인 투자자로선 마이클 블룸버그에 이어 둘째로 많은 520만달러를 후원했다. 2022년... FTX가 내세운 사업 내용과 이념은 혁신적이었지만, 부(富)를 소비하는 방식은 구시대적이었다. 뱅크먼프리드는 처음부터 가상화폐 헤지펀드 계열사..."
"3高·우크라 사태로 자영업자 11개월 연속 감소","http://www.ksilbo.co.kr/news/articleView.html?idxno=955938","경상일보","특히 3고 현상(고물가·고금리·고환율)과 러시아·우크라이나 사태 등의 여파로 울산시민들의 소비가 줄면서 자영업자 수는 11개월 연속... 20대도 4000명 늘면서 증가세로 돌아섰으며 15~19세(1000명), 50대(1000명)도 전년동월 대비 증가했다. 반면 지역 경제의 허리를 담당하는 30·40대의 낮은..."
"대기업 온라인몰, 팬데믹 거치며 종합몰 도약","http://www.apparelnews.co.kr/news/news_view/?idx=202583","어패럴뉴스","이에 비교적 소비 연령대가 높은 제도권 브랜드의 유통 채널로 주목도가 높아지고 있다. 수입 브랜드와 온라인 브랜드의 입점 증가와 공격적인... LF몰 관계자는 “30~50대 고객이 많은 게 큰 강점이었는데, 올들어 20대도 증가 추세다. 내년에는 해외 브랜드부터 잘 알려지지 않은 브랜드까지 입점을 더..."
"노트북·스마트폰에 치이더니 '수요 폭발'…대학생 '필수품' 됐다","https://www.hankyung.com/it/article/202212145709g","한국경제언론사 선정","연령별로 올해 태블릿PC 보유율을 살펴보면 30대는 47%, 20대는 50%로 젊을수록 태블릿을 갖고 있는 경우가 많았다. 특히 10대의 태블릿 보유율은 27... 삼성전자는 최근 야외 활동을 즐기는 소비자를 겨냥해 내구성 강한 '갤럭시 탭 액티브4 프로'를 출시했다. LG전자 역시 3년 만에 태블릿PC 'LG울트라탭..."
"[지역자산 기록 프로젝트- 마산어시장 알바들] 10·끝 알바의 종막","http://www.knnews.co.kr/news/articleView.php?idxno=1392387","경남신문","“이제 식구도 줄었기에 전통시장에서 구매가 생기기 매우 어려운 구조라 결국 바다 관광으로 인한 소비가 일어나야만 시장이 살아납니다. 지금 마산... 20대 아름PD는 ‘야시장’을 대안으로 제시합니다. “어시장 방문을 어려워하는 젊은 세대와의 벽을 허물 수 있는 것이 ‘야시장’이라고 생각해요.”..."
"내년 경제정책 초점은?…위기 극복·재도약","http://www.obsnews.co.kr/news/articleView.html?idxno=1377709","OBS","5% 감소하였습니다.] 고물가·고금리 등 여파로 소비도 맥을 못 추는 상황입니다. 문제는 내년 상황도 비관적이라는 데 있습니다. 글로벌 경기 둔화가... [공미숙 / 통계청 사회통계국장: 연령계층별 취업자의 전년 동월 대비 증감을 보면 40대에서 6천 명, 20대에서 4천 명 각각 감소하였습니다.] 이에 정부는..."
""대구서 새벽 차 타고 왔어요"…피켓팅 뚫고 1020女 몰린 곳 [영상]","https://www.hankyung.com/life/article/2022121448377","한국경제언론사 선정","이날부터 시작된 '어워즈&페스타'는 국내 1위 헬스앤드뷰티(H&B) 스토어 올리브영이 올해 소비자 구매 데이터를 바탕으로 트렌드를 결산하는 '올리브영... 관람객 주류는 10~20대 여성들이었다. 에코백을 여러개 멘 조모씨(25)는 “평소에 화장을 즐기고 관련 유튜브도 챙겨본다. 지난해 행사 후기를 보니..."
""푸드테크가 농생명 미래 성장산업"","http://www.jeollailbo.com/news/articleView.html?idxno=676843","전라일보","푸드테크(Foodtech)는 식품(Food)과 기술(Technology)의 합성어로 식품의 생산, 유통, 소비 전반에 인공지능(AI), 사물인터넷(IoT), 바이오기술(BT) 등 첨단기술이... 이를 위해 전문가간담회를 통해 사업기획을 구상했으며, 제20대 대통령 선거 지역 공약사업 포함시키기 위한 노력도 펼쳐왔다. 또 푸드테크 산업 분야..."
"마법의 ‘0.3% 비율’…정용진 픽 ‘순후추콘’ 이렇게 만들었다","http://news.heraldcorp.com/view.php?ud=20221214000725","헤럴드경제언론사 선정","20대 때 작은 마케팅대행사를 다녀 본 심 대표는 작은 회사의 장단점을 누구보다 잘 알았다. 소비자의 선택을 받기 위해서는 잘 아는 친숙한 브랜드와 협업이 필수적이었다. 그는 협업하는 브랜드에 로열티를 지불하되 세상에 없던 제스트코의 맛을 만드는 방식을 선택했다. 시작은..."
"“영하 10도에도 ‘코덕’들 다 모였다”…올리브영이 꾸민 ‘뷰티 천국...","https://economist.co.kr/2022/12/14/industry/normal/20221214180103578.html","이코노미스트언론사 선정","힘들게 구한 입장권인데 받을 수 있는 건 다 받아 가야죠.” 화장품을 담기 위해 캐리어까지 끌고 왔다는 한 20대 여성이 분주하게 말을 마치고 옆... 행사는 소비자들이 부스를 하나씩 방문하며 브랜드에서 마련한 퀴즈를 풀고 이벤트에 참여하며 해당 브랜드의 베스트셀러 상품을 증정받는 식으로..."
"'성관계 몰카로 실형' 작곡가가 참여한 BTS 곡… 사태가 좀 심각하다","https://www.wikitree.co.kr/articles/815397","위키트리","정 씨는 지난 2019년 교제하던 20대 가수 지망생 B씨의 신체 부위를 불법 촬영한 혐의로 재판에 넘겨졌다. B씨는 피해를 주장하며 극단 선택을 했다. 실형... 네티즌들은 "내 돌(아이돌) 곡 있는데 난 절대 소비하지 않겠다", "기사 올라온 이후로 한 번도 소비 안 했다", "업계에서 안 써줬으면 좋겠다", "내..."
"“머리 심는데 1개 3만원?, ‘이 분’은 어쩌나” 병원 잘못가면 거덜난...","http://news.heraldcorp.com/view.php?ud=20221214000717","헤럴드경제언론사 선정","특히 가장 많은 연령대가 30대이며, 20대 탈모환자도 크게 증가했다. 지난 대선에선 이재명 당시 더불어민주당 후보가 탈모 치료제에 건강보험을 적용하겠다고 공약해 주목을 끈 바 있다. 모발이식은 현재 건강보험 적용이 안 되기 때문에 소비자로선 가격 정보가 무엇보다 중요하다. 특히나 업체마다..."
"야놀자보다 싸다고? 연말 숙소 예약 꿀팁 '꿀스테이'","https://www.nbnews.kr/news/articleView.html?idxno=65530","NBN NEWS","강소기업 ○ 진행 : 김필주 전문위원 ○ 대담 : 파인스테이 김종배 의장 숙박업 자영업자와 소비자를 매칭하는 숙박예약 플랫폼 업계에 '착한 기업'이... 현재 국내 여행 앱 중에서 꿀스테이가 20대 비중이 가장 높다. (솔직하고 공정함을 중시하는 MZ 세대의 트렌드에 부합) 특히, 꿀스테이 앱에 노출되는 숙소..."
"X세대 엄마 Z세대 딸이 함께 신는다…돌아온 '못난이 부츠'","https://hankookilbo.com/News/Read/A2022121119080003745?did=NA","한국일보언론사 선정","10, 20대에 새로운 브랜드로 각인돼 트렌드가 될 수 있었다”면서 “이 영향으로 어그는 작년부터 겨울이 되기 전에 이미 품절돼 못 구하는 아이템이 됐다”고 설명했다. 2000년대 초반과 지금의 시대적 분위기가 비슷해 패션 트렌드에도 영향을 미쳤다는 분석도 있다. 이은희 인하대 소비자학과 교수는..."
"사전 예약만 2만명…"뷰티 브랜드와 트렌드를 한눈에 알 수 있어요"","https://www.news1.kr/articles/4894665","뉴스1","지난해에 이어 올해도 행사장을 찾은 20대 여성 A씨는 가득찬 짐을 들어보이며 "거의 모든 부스를 돌았는데 다양한 뷰티 브랜드를 한자리에서 볼 수... 상품 판매가 아닌 협력사가 소비자와 소통하며 브랜드와 상품 경쟁력을 알리는 홍보의 장이다. 소비자들의 반응은 뜨거웠다. 사전 예약제로 신청한 관람객..."
"[데일리픽] 애플 앱스토어 개방하나? 중국, 내년 성장률 5%↑","http://www.digitaltoday.co.kr/news/articleView.html?idxno=466711","디지털투데이","전기차 충전 앱을 가장 많이 이용하는 연령은 40대(36%), 50대 이상(29%), 30대(28%), 20대(7%) 순으로 나타났다. 40대 비율이 높은 이유를 '자동차에 관심이... 채권 매입 5년 후 만기가 도래하면 원리금을 상환받을 수 있으나, 대다수 소비자는 금전적 부담 등으로 채권을 매입하는 즉시 일정한 비용을 지불하고..."
"최연혜 가스공사 사장 "가스공사법안 국회 통과, 한전법안보다 급해"","https://www.ekn.kr/web/view.php?key=20221214010003083","에너지경제","최 사장은 지난 20대 국회에서 가스공사를 소관 기관으로 둔 산업통상자원중소벤처기업위원회(산자중기위) 위원으로 활동했다. 최 사장은 가스공사가 현... 첨부부하(Peak Load)는 생산·소비 활동에 따라 시시각각 달라지는 전력수요를 반영한 발전용량이다. 발전기를 비교적 쉽게 켰다 끌 수 있는 LNG 발전소가 이..."
"물류 '올해의 순간' ④ / 10월 - 11월","http://www.klnews.co.kr/news/articleView.html?idxno=306427","물류신문","당시 행사에서는 국민편의 제고, 소비자 보호, 전자상거래 수출 지원, 제도 및 인프라 정비 등 총 4개 분야의 20대 추진과제가 담겨 물류업계 관계자들의 관심을 끌었다. 주요 내용을 살펴보면 국민 편의제고의 경우 현재 관세청 고객지원센터에 가장 많은 민원이 들어오는 '합산과세'와 관련해 소액면세제도를..."
"SPC그룹, 삼립호빵 앞세워 매출 회복세… 연말 대목 준비도","http://www.kookje.co.kr/news2011/asp/newsbody.asp?code=0200&key=20221214.99099004528","국제신문","하지만 일각에서는 지난 10월 계열사 제빵공장에서 20대 노동자가 끼임사고를 당해 숨졌을 때 SPC그룹이 부적절하게 대처했던 것을 잊어서는 안 된다는 목소리도 여전하다. 김민주(25)씨는 “불매운동은 소비자가 업체에 분노를 표출할 수 있는 가장 직접적이고 효과적인 수단이다. 강요할 수는 없다”..."
"굽네, ‘디지털 광고 대상’ SNS 마케팅 부문 금상 수상","http://www.joseilbo.com/news/news_read.php?uid=473509&class=17&grp=","조세일보","전략으로 20대 고객에게 신선한 브랜드 이미지를 각인시키고 있다. 굽네 공식 인스타그램뿐만 아닌 홈페이지, 유튜브 등 자사 채널을 활용한 다양한 콘텐츠를 개발하고 있다. 최근 구울레옹 세계관을 확장한 신제품 남해마늘 바사삭 광고는 유튜브 공개 2주 만에 누적 조회수 100만 회를 돌파하는 등 소비자의..."
""수산 시장을 집 앞에서" CU, 활어회 픽업 서비스 400여 점포로 확대","https://www.busan.com/view/busan/view.php?code=2022121415433039758","부산일보","서비스 이용 고객을 연령대별로 분류했을 때 20대 32.3%, 30대 41.9%, 40대 20.2%, 50대 이상 5.6%로 비대면 주문 서비스에 익숙하고 새로운 편의를 추구하는 20... 코로나19로 인해 근거리 소비가 늘어나면서 주거지와의 높은 접근성을 자랑하는 편의점에서 신선 식품을 구매하고자 하는 고객 수요가 높아졌기..."
"CU, 서울 전역 400개 점포서 '활어회 픽업서비스'","http://www.edaily.co.kr/news/newspath.asp?newsid=02578086632558520","이데일리","선보였지만, 소비자들의 좋은 반응을 끌어내면서 이달부터 서울 전역에 분포한 400여 점포로 늘려 운영하기로 했다. 실제로 3월 서비스 시작한 이후 월별 매출 신장률은 4월 35.8%, 5월 28.8%, 6월 24.5%를 기록, 매달 전월 대비 두 자릿수 성장세를 이어왔다. 서비스 이용 고객을 연령대별로 분류했을 때 20대..."
"불황 속 취·창업 '꽁꽁'...2,30대 "뭐 먹고 살라고"","http://www.jibs.co.kr/news/articles/articlesDetail/27193?feed=na","JIBS언론사 선정","새로 문을 여는 사업체 절반이 20대 대표로 나타났는데, 5곳 중 1곳이 문을 닫았습니다. 연령대가 낮을수록 폐업 사례가 많았습니다. 앞으로... 한국은행 제주본부는 "국내경제 성장세 약화에 따른 관광객 소비 둔화와 가계, 그리고 기업의 심리지표 악화 등이 경기 하방 압력으로 작용할 가능성이..."
""감개무량"..첫 단독 콘서트 여는 '쎄욘세' 쎄이의 다짐(종합)[Oh!쎈 현장...","http://www.osen.co.kr/article/G1112007966","OSEN","무려 21개 트랙이 수록된 이번 앨범은 아프지만 아름다웠고, 두려웠지만 찬란했던 쎄이의 20대를 녹여낸 작품. 쎄이는 아끼는 빈티지 필름을 천천히... 음악적으로 말고 이미지적으로 소비되다 보면 거기에 치중될까봐, 그렇다 보면 내가 이어갈 음악적인 것이 흐려질까봐 고사했던 부분이 있었던 것 같다...."
"CU, 활어회 픽업 서비스 400여 점포로 확대…이용 방법은?","https://www.ziksir.com/news/articleView.html?idxno=31885","직썰","CU 수산시장 활어회 픽업 서비스 [BGF리테일] 이용 고객을 연령대로 분류했을 때 20대 32.3%, 30대 41.9%, 40대 20.2%, 50대 이상 5.6%로 비대면 주문 서비스에... 코로나19로 인해 근거리 소비가 늘어나면서 주거지와의 높은 접근성을 자랑하는 편의점에서 신선 식품을 구매하고자 하는 고객 수요가 높아졌기..."
"MZ세대 공략하는 '1개월 초단기 정기적금' 흥행할까","http://news.tf.co.kr/read/economy/1985854.htm","더팩트","현재 26주적금의 고객 구성 비율은 20대 32.05%, 30대 32.01%로, MZ세대가 전체의 64.01%를 차지하는 것으로 알려졌다. 카카오뱅크는 '26주 적금'을 통해 금융소비자들이 '소확행(소소하지만 확실한 행복)'을 느낄 수 있다고 설명했다. 여행, 쇼핑 등 계획적인 소비 생활을 누리는 MZ세대 특성에 초단기적금이..."
"[기자수첩 米적米적] "집에 밥솥이 없어서 (쌀) 안 주셔도 돼요."","http://www.newsfarm.co.kr/news/articleView.html?idxno=80187","한국농업신문","그때 20대 정도로 보이는 젊은 시민 한 분은 한사코 나눠주는 쌀을 받지 않겠다고 했다. 집에 밥솥이 없다는 이유에서다. 1인 가구가 늘고 있고, 쌀 소비량이 점점 줄어들고 있는 요즘, 이 같은 모습이 낯설게만 느껴지지 않는다. 혼자 사는 이들 가운데에서는 집에서 요리를 따로 하지 않고, 간편식을 주로..."
"수산 시장을 집 앞으로! CU, 활어회 픽업 서비스 확대","http://www.insightkorea.co.kr/news/articleView.html?idxno=101604","인사이트코리아","서비스 이용 고객을 연령대별로 분류했을 때 20대 32.3%, 30대 41.9%, 40대 20.2%, 50대 이상 5.6%로 비대면 주문 서비스에 익숙하고 새로운 편의를 추구하는 20... 코로나19로 인해 근거리 소비가 늘어나면서 주거지와의 높은 접근성을 자랑하는 편의점에서 신선 식품을 구매하고자 하는 고객 수요가 높아졌기..."
"[AT 유통 소식] CU·롯데마트·롯데호텔","https://www.asiatime.co.kr/article/20221214500006","아시아타임즈","서비스 이용 고객을 연령대별로 분류했을 때 20대 32.3%, 30대 41.9%, 40대 20.2%, 50대 이상 5.6%로 비대면 주문 서비스에 익숙하고 새로운 편의를 추구하는... 코로나19로 인해 근거리 소비가 늘어나면서 주거지와의 높은 접근성을 자랑하는 편의점에서 신선 식품을 구매하고자 하는 고객 수요가 높아졌기..."
"“편의점서 회를 판다고?”…CU, 활어회 픽업 서비스 확대","https://www.mk.co.kr/article/10567923","매일경제","서비스 이용 소비자를 연령대로 살펴보면 ▲20대 32.3% ▲30대 41.9% ▲40대 20.2% ▲50대 이상 5.6% 순으로 나타났다. 지역별로는 주거지 상권 점포들의 매출이 약 75%를 차지했다. ▲가족 주택 42.2% ▲빌라촌 23.3% ▲원룸 밀집 지역 9.2% 등 순이다. CU는 코로나19 확산 후 소비자들의 외출 반경이 줄어들면서..."
"물가 오르자 명품, 의류·패션잡화 소비부터 줄인다","http://www.datasom.co.kr/news/articleView.html?idxno=125761","데이터솜","롯데멤버스 김근수 데이터사업부문장은 "불경기가 닥치면서 소비자들이 당장 꼭 필요한 품목 외에는 지갑을 닫고 있지만 건강과 직결되는 먹거리만큼은 무작정 줄이기보다 자신의 상황과 기호에 맞게 선택적으로 소비하고 있다"며 "특히 20대의 경우 중장년층보다 건기식 소비는 덜 줄이고 주류..."
"산업은행 이전 강행, 왜 그들은 반대 목소리에 귀를 닫는가?","http://www.updownnews.co.kr/news/articleView.html?idxno=303586","업다운뉴스","앞서 윤석열 대통령은 제20대 대통령 선거 후보인 당시 산은 본점의 부산 이전 공약을 내걸었고, 올해 새로이 임명된 강석훈 회장을 비롯한 산은 임원진은... ■ 그 질문은 일반 금융소비자에게라면 충분히 적용될 수 있다. 하지만 산은의 업무를 일반 금융소비자를 대상으로 한 업무와 착각해선 안 된다. 가령..."
"12월13일 이브닝뉴스 헤드라인","https://www.radiokorea.com/news/article.php?uid=405004","라디오코리아","5.미국의 CPI, 소비자 물가가 11월에 7.1% 상승으로 더 진정됐다. 소비자 물가는 6월에 9.1%로 정점을 찍은 후에 물가잡기를 위한 연속 금리인상으로 매달... 13.10~20대를 위주로 광범위하게 사용되는 중국의 동영상 공유 플랫폼 틱톡을 미국에서 전면 금지하는 법안이 상하원에서 동시에 발의됐다. 틱톡의 모회사인..."
"CU '활어회 픽업 서비스' 서울 전역으로 확대","https://www.news2day.co.kr/article/20221214500066","뉴스투데이","서비스 이용 고객을 연령대별로 분류했을 때 △20대 32.3% △30대 41.9% △40대 20.2% △50대 이상 5.6%로 비대면 주문 서비스에 익숙하고 새로운 편의를... CU는 코로나19로 인해 근거리 소비가 늘면서 주거지와 높은 접근성을 자랑하는 편의점에서 신선 식품을 구매하고자 하는 고객 수요가 높아졌다고..."
"경기침체에 고용시장도 '냉각'…취업자 증가폭 '뚝'","https://biz.newdaily.co.kr/site/data/html/2022/12/14/2022121400029.html","뉴데일리","20대(-4000명)와 40대(-6000명)에선 줄었다. 40대는 5개월 연속 감소세다. 다만 감소폭은 둔화했다. 20대 감소도 눈에 띈다. 20대는 올 1월 27만3000명을... 소비자물가가 정점을 지났다지만, 당분간 5%대 고물가가 이어질 전망인데다 금리 인상 여파와 수출 위축 등 하방요인이 수두룩하다...."
"스마트폰 속 모두 똑같은 얼굴에 대하여","https://www.vogue.co.kr/2022/12/14/%ec%8a%a4%eb%a7%88%ed%8a%b8%ed%8f%b0-%ec%86%8d-%eb%aa%a8%eb%91%90-%eb%98%91%ea%b0%99%ec%9d%80-%ec%96%bc%ea%b5%b4%ec%97%90-%eb%8c%80%ed%95%98%ec%97%ac/?utm_source=naver&utm_medium=partnership","VOGUE","소비자에게 직거래하는 DTC(Direct-To-Consumer) 브랜드는 팟캐스트 광고 시간을 직배송 음식, 전동 칫솔이 제시하는 약속으로 채워가며, 선택을 포기하는 데서... 그 병원을 나서며 20대 초반으로 보이는 아주 예쁜 여성 세 명과 함께 엘리베이터를 탔다. 차를 몰아 숙소로 돌아오는데 슬픔이 밀려오면서 기분이..."
"수산시장 대신 편의점 간다…CU, 활어회 픽업 서비스 확대","http://www.mkhealth.co.kr/news/articleView.html?idxno=61577","매경헬스","20대 32.3%, 30대 41.9%, 40대 20.2%, 50대 이상 5.6%이었다. CU는 젊은 세대가 비대면 주문 서비스에 익숙하고 새로운 편의를 추구하기 때문이라고... 박희진 BGF리테일 서비스플랫폼팀장은 "코로나19로 주거지와 가까운 편의점에서 신선 식품을 구매하려는 소비자가 늘었기 때문"이라며 "이에 고품질의..."
"“낮 12시 전 주문하세요”…수산시장 활어회, 편의점에서 받는 법","https://economist.co.kr/2022/12/14/industry/distribution/20221214095544659.html","이코노미스트","서비스 이용 소비자를 연령대별로 보면 20대 32.3%, 30대 41.9%, 40대 20.2%, 50대 이상 5.6%로 비대면 주문 서비스에 익숙하고 새로운 편의를 추구하는 20~30대가 큰 비중을 차지했다. 편의점 매장 입지별로 매출 비중을 살펴본 결과로는 가족 주택 42.2%, 빌라촌 23.3%, 원룸 밀집 지역 9.2%로, 주거지 상권 점포들의..."
"핀크 "마이데이터 시행 1년 만에 누적 가입자 800%↑"","https://www.newsway.co.kr/news/view?tp=1&ud=2022121409510450990","뉴스웨이","연령대별로는 30대(27%)가 가장 많았으며, 40대(26%), 20대(25%), 50대(14%), 60대(8%) 순으로 뒤를 이었다. 권영탁 핀크 대표는 "작년 12월 마이데이터 서비스를 오픈한 이후 활용 분야를 적극적으로 확장하고 고도화해 소비자의 편익을 확대하고 있다"면서 "앞으로도 서비스 전반에 마이데이터를 확대 적용하고..."
"CU, 활어회 픽업서비스 400여 점포로 확대한다","http://www.biztribune.co.kr/news/articleView.html?idxno=271690","비즈트리뷴","서비스 이용 고객을 연령대별로 분류했을 때 20대 32.3%, 30대 41.9%, 40대 20.2%, 50대 이상 5.6%로 비대면 주문 서비스에 익숙하고 새로운 편의를 추구하는 20... 코로나19로 인해 근거리 소비가 늘어나면서 주거지와의 높은 접근성을 자랑하는 편의점에서 신선 식품을 구매하고자 하는 고객 수요가 높아졌기..."
"낮에 주문한 회, 당일 저녁 집 앞 CU에서 찾는다","http://www.foodnews.co.kr/news/articleView.html?idxno=100116","식품저널 foodnews","연령대별 서비스 이용 고객은 20대 32.3%, 30대 41.9%, 40대 20.2%, 50대 이상 5.6%로, 비대면 주문 서비스에 익숙하고 새로운 편의를 추구하는 20~30대 비중이 컸으며, 입지별 매출 비중은 가족 주택 42.2%, 빌라촌 23.3%, 원룸 밀집 지역 9.2%로, 주거지 상권 점포 매출이 75%가량을 차지했다. 코로나19로 근거리 소비가..."
"CU, 수산시장 회 픽업 서비스 400개 매장으로 확대","https://www.ekn.kr/web/view.php?key=20221214010003007","에너지경제","서비스를 이용하는 소비자를 연령대별로 분류했을 때 20대 32.3%, 30대 41.9%, 40대 20.2%, 50대 이상 5.6%로 비대면 주문 서비스에 익숙하고 새로운 편의를 추구하는 20~30대가 큰 비중을 차지했다. 특히 CU가 입지별로 매출 비중을 살펴본 결과 가족 주택 42.2%, 빌라촌 23.3%, 원룸 밀집 지역 9.2%로 주거지 상권..."
