Title,Link,Press,Description
"콴텍 평균 투자 3576만원…'파이어족 꿈꾸기' 최다 가입","http://www.newsis.com/view/?id=NISX20221227_0002137987&cID=13001&pID=13000","뉴시스","연령대 비율은 40대(37%), 30대(24%), 50대(20%), 20대(13%), 60대 이상(6%) 이었다. 고객 연령대별 평균 투자 금액을 살펴보면 60대 이상이 2억5667만원으로 가장 많았다. 올해 콴텍투자일임 고객의 1인당 평균 가입 상품의 수는 1.3개였다. 콴텍투자일임 관계자는 "내년에는 B2B2C(기업·소비자 모두와 동시에 거래)..."
""2023년, 2차전지보다 수소 관련주 주목"","https://www.nocutnews.co.kr/news/5870609","노컷뉴스","중국 소비 관련 삼성전기, LG이노텍 등 IT부품 주목 소부장 기업, 반도체, 방산, 조선, 철강 업종 긍정 그린에너지 테마 주목…두산퓨얼셀, 상아프론테크... 테슬라가 내년 PER 20대에 들어왔다고 하니, 앞으로는 관련 2차전지 종목들도 일정한 밸류를 받고 그 사이에서 움직이지 않을까 생각합니다. 그래서..."
"콴텍 "1인당 투자금액 평균 3576만원…최고 40억원"","http://www.inews24.com/view/1552836","아이뉴스24","콴텍투자일임 고객 성별은 남성이 80%였으며 연령대 비율은 40대(37%), 30대(24%), 50대(20%), 20대(13%), 60대 이상(6%) 순으로 나타났다. 고객 연령대별 평균... 고객의 관심을 확인할 수 있었다"며 "내년에는 B2B2C(기업·소비자 모두와 동시에 거래) 서비스로 사업 영역을 확대해 더 많은 고객과 만날 계획"이라고 말했다."
"울릉도 방문자가 가장 오래 머물러…국내 50대 이상 울릉도 선호 1위","http://www.kbmaeil.com/news/articleView.html?idxno=946640","경북매일신문","울릉도를 방문한 연령대는 10대 3.3%, 20대 10.5%, 30대 10.5%, 40대12.3%, 50대 28.4%, 60대 34.3%를 차지 50대 이상 60%가 넘어 젊은이들이 찾는 관광 마케팅전략이 필요할 것으로 보인다. 김영미 관광공사 관광빅데이터실장은 "지역별 축제 기간에 방문자들이 어느 지역에서 오는지와 함께 소비 내용, 내비게이션..."
"[스타트업 단신] 로톡, 김캐디, 콴텍투자일임, 두들린, 그립컴퍼니 연말...","https://platum.kr/archives/199627","플래텀","의뢰인은 로톡을 통해 변호사와 법률 정보를 손쉽게 검색할 수 있고, 변호사는 스스로를 효과적으로 홍보하며 원하는 분야 및 지역의 법률 소비자를... 콴텍투자일임 고객 성별은 남성이 80%였으며, 연령대 비율은 40대(37%), 30대(24%), 50대(20%), 20대(13%), 60대 이상(6%) 순으로 나타났다. 하지만, 고객 연령대별..."
""시장에 털리느니, 로보어드바이저에 40억원 투자한다"","http://www.bloter.net/newsView/blt202212270007","블로터언론사 선정","콴텍투자일임 고객 성별은 남성이 80%였으며, 연령대 비율은 40대(37%), 30대(24%), 50대(20%), 20대(13%), 60대 이상(6%) 순으로 나타났다. 고객 연령대별 평균... 관심을 확인할 수 있었다"며 "2023년에는 B2B2C(기업·소비자 모두와 동시에 거래) 서비스로 사업 영역을 확대해 더 많은 고객과 만날 계획"이라고 말했다."
"20대 95%, OTT 이용한다… 유튜브·넷플릭스 ‘압도적’","http://www.newscj.com/article/20221227580135","천지일보","OTT 이용률은 연령별로는 20대 OTT 이용률이 95.9%로 가장 높았다. 10대와 30대는 90%대의 이용률을 보였으며 40대부터 연령대가 높을수록 OTT 이용률이... 지난 9월 소비자리서치 전문기관 컨슈머인사이트가 전국 14세 이상 64세 이하 휴대폰 사용자 3만 4673명을 대상으로 진행한 올해 상반기 OTT 이용..."
"달라진 자사앱…게임하고 웹툰도 본다","http://www.smedaily.co.kr/news/articleView.html?idxno=245731","중소기업신문","이마트24(Emart24)와 유니버스(Universe)를 합친 용어로, 소비자들이 앱 내에서 게임을 할 수 있는 것이 가장 큰 특징이다. 이마트24는 이를 위해 지난해... 특히 10대에서 20대 중반까지 Z세대로부터 입소문이 나 매니아층을 이루고 있다. 외에도 이커머스 컬리와 중고거래앱 당근마켓도 앱 기능을 다양화하고 있다...."
"SPC 사태 70여일 후… 을의 눈물 속 아이러니한 호실적","https://www.thescoop.co.kr/news/articleView.html?idxno=56283","더스쿠프언론사 선정","지난 10월 15일 20대 젊은 노동자가 안타까운 죽음을 맞았다. SPC그룹(이하 SPC) 계열의 SPL 평택공장에서 일하던 이 노동자는 샌드위치 소스를 배합하는... 결국 소비자들이 SPC 경영진이 책임 의식을 갖고 안전경영 시스템을 정착할 수 있도록 관심을 끊지 않아야 한다." ■ 가맹점은 지금… = 이번엔 가맹점의..."
"송진옥 이사 “세금 연봉 대비 점점 늘고 있어…종신 등 보장성보험 절...","http://www.fntimes.com/html/view.php?ud=2022122710223182198a55064dd1_18","한국금융신문","연령대별 자산관리로 20대는 단기, 중기 자금 계획을, 30~40대는 사치품 소비 점검과 비과세혜택 상품을, 50~60대는 부채 정리를 중점적으로 보라고 조언했다. 송진옥 이사는 "20~30대는 고정수입이 없고 아르바이트를 하는 경우가 많으므로 통장을 3개씩 만들고 돈의 가용성을 고려해 단기, 중기 계획을 짜야 한다..."
"설로인, 연말연시 ‘설램 숙성한우 선물세트’ 출시","https://view.asiae.co.kr/article/2022122710375834366","아시아경제","가족이나 지인들을 위한 선물을 고민하는 소비자들의 니즈에 맞춰 설로인은 합리적인 가격대로 제품 구성을 다양하게 마련하여 고급화된 상품들도 함께... 특히 신규 출시한 ‘설램 숙성한우 선물세트’의 경우 20대 후반부터 30대 중반의 직장인들도 부담없이 접근할 수 있도록 10만 원 내외의 매력적인..."
"콴텍, 연말 결산 공개…“1인당 평균 투자금 3600만원”","https://www.dailian.co.kr/news/view/1187232/?sc=Naver","데일리안","콴텍투자일임 고객 성별은 남성이 80%였으며, 연령대 비율은 40대(37%), 30대(24%), 50대(20%), 20대(13%), 60대 이상(6%) 순으로 나타났다. 고객 연령대별 평균... 관심을 확인할 수 있었다”며 “2023년에는 B2B2C(기업·소비자 모두와 동시에 거래) 서비스로 사업 영역을 확대해 더 많은 고객과 만날 계획”이라고 말했다."
"하이볼 열풍이 전통주로 이어지길","http://www.idaegu.com/newsView/idg202212270001","대구일보","이전에는 기존에 출시돼 있던 제품들을 섞어 전혀 다른 새로운 메뉴로 재탄생시키는 ‘푸드 믹솔로지(food mixology)’가 소비자들 사이에서 큰 인기를 끈... 홈플러스의 2022년 위스키 매출은 지난해보다 46% 증가했고 이중 20대와 30대의 위스키 구매는 같은 기간 71%나 늘어났다. CU의 양주 매출 중 20·30대 비중도..."
"'파이어족' 꿈꾸는 30·40대…"평균 1600만원 일임투자"","http://news.mt.co.kr/mtview.php?no=2022122708552283319","머니투데이","콴텍의 고객 중 80%가 남성이었으며, 연령대 비율은 40대(37%), 30대(24%), 50대(20%), 20대(13%), 60대 이상(6%) 순으로 나타났다. 고객 연령대별 평균 투자... (기업·소비자 모두와 동시에 거래) 서비스로 사업 영역을 확대할 계획"이라고 말했다. 한편, 콴텍투자일임은 비대면 자산관리 플랫폼 '콴텍'의 운영사로 B2C..."
"설로인, 연말연시 맞아 '설램 숙성한우 선물세트' 출시","http://www.edaily.co.kr/news/newspath.asp?newsid=01495686632562784","이데일리","설로인은 가족이나 지인들을 위한 선물을 고민하는 소비자들의 니즈에 맞춰 합리적인 가격대로 제품 구성을 다양하게 마련하여 고급화된 상품들도 함께... 설램 숙성한우 선물세트는 20대 후반부터 30대 중반의 직장인들도 부담 없이 접근할 수 있도록 10만 원 내외의 가격으로 판매된다. 설로인 선물세트는..."
"콴텍, 올해 최대 인기 상품은 '파이어족 꿈꾸기'","http://www.greenpostkorea.co.kr/news/articleView.html?idxno=204396","그린포스트코리아","콴텍투자일임 고객 성별은 남성이 80%였으며, 연령대 비율은 40대(37%), 30대(24%), 50대(20%), 20대(13%), 60대 이상(6%) 순으로 나타났다. 하지만, 고객 연령대별... 관심을 확인할 수 있었다"며, "2023년에는 B2B2C(기업·소비자 모두와 동시에 거래) 서비스로 사업 영역을 확대해 더 많은 고객과 만날 계획"이라고 말했다."
"[세계와 맞서는 삼성전자 上] 애플과의 건곤일척 승부, 공략 포인트는","https://www.asiatime.co.kr/article/20221226500081","아시아타임즈","이 밖에 여전히 투박한 디자인과 높은 장년층 사용자 비중으로 인해 ‘아재(아저씨) 폰’ 이미지를 벗지 못한 점은 현재 10~20대 소비자들이 구매력을 갖게 됐을 때 판매 확장에 걸림돌이 될 가능성도 존재한다. 재고관리 전문가 출신 CEO의 저력…애플의 현주소 아이폰14프로..."
"한파, 에너지價 급등에 英 전역 3천개 설치된 ‘웜뱅크’는 무엇?","https://biz.chosun.com/international/international_general/2022/12/27/SXDZ6OQJAZC6LAWRZNBZOBT6YU/?utm_source=naver&utm_medium=original&utm_campaign=biz","조선비즈","노리치에서 웜 뱅크를 운영하는 복지 단체 직원 그레이스 리처드슨은 “젊은 부모부터 연금 수급자, 20대 학생까지 다양한 계층이 웜 뱅크를 이용한다”면서 “이제는 정규직 근로자도 생계 유지가 어려워 웜 뱅크를 이용하고 있다는 것이 이전의 위기와 달라진 점”이라고 했다. 영국은 지난 10월 소비자..."
"“전북지역 지역화폐 사용 소매업·요식업이 85%”","https://news.kbs.co.kr/news/view.do?ncd=6106970&ref=A","KBS","전라북도가 지난 2020년과 지난해 2년 동안 지역화폐의 소비 성향을 분석한 결과, 소매업과 요식업이 85퍼센트로 가장 많고, 20대에서 40대까지 젊은 층 이용률이 가장 높았습니다. 지역별 이용률은 전주시가 36퍼센트로 가장 많고, 결제 건수는 익산이 3.6건으로 최고치를 기록했습니다. 전라북도는 내년에..."
"2022년 한의계 키워드…초음파 무죄 및 자보 치료 제한 시위 등","http://www.mjmedi.com/news/articleView.html?idxno=55892","민족의학신문","그는 경희한의대를 졸업하고 동 대학원에서 석·박사를 취득한 뒤 제약회사 씨와이 CEO를 역임했으며 서울시한의사회 부회장을 맡았고, 20대 대통령... ■대법원, 한의사 초음파 진단기 사용 무죄 대법원 전원합의체 판결은 의료행위의 가변성, 과학기술의 발전, 교육과정·국가 시험의 변화, 의료소비자의..."
"(인터뷰)이종걸 “삼성생명, 총수 일가 사금고로 전락…불공정 끊어내야...","http://www.newstomato.com/ReadNews.aspx?no=1168903&inflow=N","뉴스토마토","이후 20대 국회에서 재발의됐으나 별다른 논의도 이뤄지지 못한 채 맥없이 폐기됐다. 이 의원은 지난 23일 서울 마포구 사무실에서 <뉴스토마토>와 만나... 하지만 일자리가 없어지고, 기업에선 직원들을 몰아내고, 자영업자가 많아져 소비가 떨어지고, 일부 국민은 투기형 투자로 어려워졌고, 그 시작이..."
"(2022 결산)대내외 잇딴 악재…식품업계 ‘다사다난’","http://www.newstomato.com/ReadNews.aspx?no=1169039&inflow=N","뉴스토마토","샌드위치 내용물 부실 논란으로 소비자들의 질타를 받았고 지난 4월에는 종이빨대의 휘발유 냄새 발생 등 품질 논란으로 제품을 전량 리콜하기도 했다. ‘포켓몬 빵’ 열풍으로 상반기까지 미소를 짓던 SPC는 하반기 대형 악재를 맞았다. SPC그룹 계열 SPL 평택 제빵공장에서 20대 근로자 A씨가 기계에 몸이 끼어..."
"[관점뉴스] LG전자 조주완 호(號)가 쏘아 올린 '백색가전 돌풍' 에 눈길...","https://www.news2day.co.kr/article/20221226500233","뉴스투데이","'유행은 돌고 돈다'는 말처럼 결국 과거의 것이 다시 인기를 끌듯 백색가전에 대한 소비자 반응도 호의적이다. 홀로 거주 중인 20대 프리랜서 이모씨는 “혼자 혹은 신혼부부가 사는 집은 공간이 크지 않은 경우가 많은데 색상이 많이 들어간 가전제품을 들이게 되면 자칫 더 좁아 보이는 경우가 있다”며..."
"윤 대통령 당선 ‘용산시대’…158명 스러진 ‘이태원 참사’ [국내10대...","https://www.hani.co.kr/arti/economy/economy_general/1073255.html","한겨레언론사 선정","실언 논란 뒤 멈춰선 ‘도어스테핑’…야당 협치는 과제로 3월9일 제20대 대선에서 윤석열 대통령이 당선됐다. 2위인 이재명 더불어민주당 후보와는... 이제훈 선임기자 nomad@hani.co.kr 고물가·고금리·고환율 3중고 글로벌 인플레이션 압력이 소비·투자·수출·금융·부동산 등 경제 영역 전반에 휘몰아친..."
"[하이테크리포트] 올해도 '고생길' 네카오…규제 강화 움직임에 외부 변...","https://www.ajunews.com/view/20221226114555397","아주경제","'카카오 먹통' 이후 180도 달라졌다…정부 규제 강화 움직임에 플랫폼 업계 '촉각' 지난 3월 제20대 대통령선거에서 윤석열 국민의힘 후보가 간발의 차로... 네이버는 지난 10월 북미 소비자간거래(C2C) 플랫폼인 '포쉬마크'를 2조3000억원에 인수한다고 발표하며 창사 이래 최대 투자를 확정지었다. 지난 20일부터는..."
"[금융 이모저모] 신한은행, 안심택배함 서비스 확대운영","http://www.greened.kr/news/articleView.html?idxno=299792","녹색경제신문","그동안 청약통장 정보는 가입한 은행앱에서만 확인할 수 있어 금융 소비자의 불편이 있다는 지적을 받아왔다. 토스는 '중소벤처·소상공인 정책사업... 연령대 별로는 20대가 가장 큰 폭으로 회복해 코로나 이전수준까지 도달했고, 그 외 연령대는 40% 수준에 머물렀다. 지역 별 회복률은 일본이 140%로 가장..."
"“무료로 추위 피하라”… 英, 에너지 요금 급증에 웜뱅크 3000개 설치","https://www.chosun.com/international/international_general/2022/12/26/7TCDG5TGFJGBXIWIOUQQR5UY5M/?utm_source=naver&utm_medium=referral&utm_campaign=naver-news","조선일보","이곳에서 웜 뱅크를 운영하는 복지 단체 직원 그레이스 리처드슨은 “젊은 부모부터 연금 수급자, 20대 학생까지 다양한 계층이 웜 뱅크를 이용한다”면서 “이제는 정규직 근로자도 생계 유지가 어려워 웜 뱅크를 이용하고 있다는 것이 이전의 위기와 달라진 점”이라고 했다. 영국은 지난 10월 소비자..."
"[뉴스 더하기] 2023년 달라지는 것들","https://news.kbs.co.kr/news/view.do?ncd=6106654&ref=A","KBS",""나는 아직 만으로 20대야" "나는 만 30대야" 이렇게 조금이라도 어려지고 싶어서 했던 말들도 이제는 역사 속 과거 사람들이 했던 말로 남게 되겠네요. 두 번째는 유통기한은 옛말, '이제는 소비기한'입니다. 판매되는 식품에 의무적으로 표기된 유통기한, 말 그대로 식품을 유통할 수 있는 기한이기 때문에..."
"엔씨가 리니지 이후를 바라보는 이유는? [포스트 리니지 꿈꾸는 엔씨①...","https://economist.co.kr/2022/12/26/it/general/20221226190012734.html","이코노미스트언론사 선정","리니지를 비롯한 대다수 게임이 많은 시간과 높은 과금을 요구하는 하드코어 RPG이다 보니, 최근 새로운 소비 주축으로 떠오른 MZ세대에게 큰 인기를... 특히 10대와 20대는 원작 리니지에 대해 이름만 들어봤을 뿐 직접 경험하지는 못했다. 당연히 리니지에 대한 추억 역시 없다. 리니지M과 리니지2M이 큰..."
"[카드뉴스] 양주시 주요뉴스 (12월 26일)","http://www.weeklytoday.com/news/articleView.html?idxno=552298","위클리오늘","이번 교육은 기후변화에 따른 신품종 소개, 재배기술 등 체계적인 콩 재배법을 현장 애로기술 사례로 교육생들의 이해도를 높이고 소비자에게... 20대부터 건설업에 뛰어들었던 현장경험을 의정활동에 접목해 이달 초 시민의 숙원이던 '국도3호선 확장사업 신속 이행 촉구 건의안' 채택을 이끌어냈다. 그는..."
"배민앱으로 웹툰 본다...'만화경' 서비스 도입","https://news.mtn.co.kr/news-detail/2022122617554072933","머니투데이방송","이중 매월 콘텐츠를 실제 소비하는 이용자도 35만명이 넘는다.올해 만화경의 빠른 성장은 전체 회원의 70%를 차지하는 10~20대 중반 독자의 입소문이 크게 기여한 것으로 나타났다. 만화경의 대표 인기 콘텐츠인 키크니 작가의 ‘별일 없이 산다’부터 감자 작가의 ‘대흉작 감자밭’ 등이 Z세대에 큰 인기를..."
"[SR유통] '배달의민족'에서 만화도 본다…'만화경' 탭 신설","http://www.srtimes.kr/news/articleView.html?idxno=126544","SR타임스","이중 매월 콘텐츠를 실제 소비하는 이용자도 35만명이 넘는다. 올해 만화경의 빠른 성장은 전체 회원의 70%를 차지하는 10~20대 중반 독자의 입소문이 크게 기여한 것으로 나타났다. 만화경의 대표 인기 콘텐츠인 키크니 작가의 '별일 없이 산다'부터 감자 작가의 '대흉작 감자밭' 등이 인기를 끌었다. 김명철..."
"배달의민족 앱 내에 웹툰 플랫폼 '만화경' 탭 신설...회원가입 없이 무...","http://www.consumernews.co.kr/news/articleView.html?idxno=666981","소비자가 만드는 신문","이중 매월 콘텐츠를 실제 소비하는 이용자도 35만 명이 넘는다.▲배민 앱 내 'My배민'에 우아한형제들의 웹툰 플랫폼 '만화경' 탭이 추가됐다.올해 만화경의 빠른 성장은 전체 회원의 70%를 차지하는 10~20대 중반 독자의 입소문이 크게 기여한 것으로 나타났다. 만화경의 대표 인기 콘텐츠인 키크니 작가의..."
"배달의 민족 앱에서 '만화경' 웹툰 본다","http://www.dailyimpact.co.kr/news/articleView.html?idxno=90284","딜사이트경제TV","올해 만화경의 급성장은 전체 회원의 70%를 차지하는 10~20대 중반 독자의 입소문 탓이다. 플랫폼 내 대표 인기 콘텐츠인 키크니 작가의 '별일 없이 산다'부터 감자 작가의 '대흉작 감자밭' 등이 Z세대에 인기를 끌면서 다른 연재 작품에 대한 호응도 덩달아 높아졌다. 이에 따라 매월 콘텐츠를 실제 소비하는..."
"[오늘의 장바구니] 현대백화점·LF·롯데관광개발 외","http://www.newsprime.co.kr/news/article.html?no=588838","프라임경제","이중 매월 콘텐츠를 실제 소비하는 이용자도 35만명이 넘는다. 올해 만화경의 빠른 성장은 전체 회원의 70%를 차지하는 10~20대 중반 독자의 입소문이 크게 기여한 것으로 나타났다. 만화경의 대표 인기 콘텐츠인 키크니 작가의 '별일 없이 산다'부터 감자 작가의 '대흉작 감자밭' 등이 Z세대에 큰 인기를..."
"“만화 맛집 ‘만화경’ 이제 배민 앱에서 만나세요”","http://www.sentv.co.kr/news/view/641250","서울경제TV","이중 매월 콘텐츠를 실제 소비하는 이용자도 35만명이 넘는다. 올해 만화경의 빠른 성장은 전체 회원의 70%를 차지하는 10~20대 중반 독자의 입소문이 크게 기여한 것으로 나타났다. 만화경의 대표 인기 콘텐츠인 키크니 작가의 ‘별일 없이 산다’부터 감자 작가의 ‘대흉작 감자밭’ 등이 Z세대에 큰 인기를..."
"[유통산책] 만화 맛집 ‘만화경’, 이제 배민 앱에서 만나요 外","http://www.g-enews.com/ko-kr/news/article/news_all/202212261633327266fd3ea9dd48_1/article.html","글로벌이코노믹","이중 매월 콘텐츠를 실제 소비하는 이용자도 35만명이 넘는다. ◆G마켓, 설 선물 사전구매 프로모션 G마켓이 본격적인 설 프로모션을 앞두고 내달... 하나투어 닷컴 예약 비중은 20대가 2019년 45.9%에서 2022년 69.3%로, 30대는 2019년 34.6%에서 59.4%로 증가했다. 최고가 상품은 1인 3415만4000원의 남프랑스..."
"[되돌아본 2022 유통가 1년(上)] 리오프닝과 고물가 뒤엉킨 상반기","http://www.metroseoul.co.kr/article/20221226500489","메트로신문","<편집자 주> ◆1월 오미크론 확산과 설…명절 선물세트의 초 프리미엄화 1월, 유통가는 오미크론과 보복소비의 여파 속에 있었다. 12월부터 이어진... 신세계에 따르면 지난해 신세계백화점의 골프웨어 장르는 56.3% 성장했으며, 특히 20대와 30대 고객의 매출 성장이 가장 높게 나타났다. 이마트는 마트 내..."
""이젠 화장 제대로 해야죠" 실내마스크 해제에 화색도는 업계","https://view.asiae.co.kr/article/2022122614013586264","아시아경제",""다음 달에 그간 미뤄왔던 화장품 좀 사려고요" 20대인 사회초년생 A 씨는 코로나19로 재택근무와 마스크 착용이 길어지면서 굳이 화장할 필요가 없었다.... 미샤, 어퓨 등을 운영하는 에이블씨엔씨는 최근 실내 마스크 해제에 대한 기대감에 색조 화장품을 찾는 소비자가 늘어날 것으로 보고, 이달 말까지..."
"올해 연령별 베스트셀러 트렌드… 2030 대본집 소장 '열풍'","http://www.shinailbo.co.kr/news/articleView.html?idxno=1641533","신아일보","특히 이러한 열풍은 콘텐츠 소비가 활발한 20, 30대가 주도하고 있다. 예스24 집계 결과 올해 출간된 영화·드라마 연계 도서는 78종으로 최근 3년 중 가장... 20대가 구매한 2022년 영화·드라마 연계 도서 베스트셀러 1위는 'N차 관람' 열풍을 이끈 영화 '헤어질 결심'의 각본집 '헤어질 결심 각본'이 차지했다...."
"[팀장 칼럼] ‘토리 아빠’ 尹대통령의 반려동물 사랑이 더욱 빛나려면","https://biz.chosun.com/opinion/leader_column/2022/12/26/HMWSGD2QXNCMBKB2WEDWO3OAX4/?utm_source=naver&utm_medium=original&utm_campaign=biz","조선비즈","‘제20대 대통령직인수위원회 백서’에 따르면 총 110대 국정과제 중 37번 ‘금융소비자 보호 및 권익향상’ 부문에는 ‘맞춤형 펫보험 활성화를 위해 반려동물 등록과 간편한 보험금 청구 시스템 구축을 추진한다’는 문구가 명시됐다. 그러나 지난 5월 윤석열 정부 출범 후 보험 업계에서는 그 누구도 선뜻..."
"‘고인물’로 1억뷰 찍은 CU, 이번엔 ‘뚝딱이’ 선보인다고?","https://www.mk.co.kr/article/10582368","매일경제","숏폼 형태로 선보이기로 한 것도 편의점 주 고객층의 영상 콘텐츠 소비 방식에 들어맞는다. 메조미디어가 지난 2019년 발간한 타깃 오디언스 리포트에 따르면 10대와 20대는 다른 연령층에 비해 동영상 1회 시청 시간이 15분 내외로 가장 짧다. 특히 10대의 경우 1회 시청 시간으로 가장 선호하는 시간이 10분..."
"[생활경제 이슈] 배민앱 내 ‘My배민’에 웹툰 만화경 탭 추가 外","http://www.lawissue.co.kr/view.php?ud=202212261526559015204ead0791_12","로이슈","이중 매월 콘텐츠를 실제 소비하는 이용자도 35만명이 넘는다. 올해 만화경의 빠른 성장은 전체 회원의 70%를 차지하는 10~20대 중반 독자의 입소문이 크게 기여한 것으로 나타났다. 만화경의 대표 인기 콘텐츠인 키크니 작가의 ‘별일 없이 산다’부터 감자 작가의 ‘대흉작 감자밭’ 등이 Z세대에 큰..."
"배민으로 떡볶이 시키고, 웹툰도 볼까?","https://www.ddaily.co.kr/news/article.html?no=254197","디지털데일리","매월 콘텐츠를 실제 소비하는 이용자도 35만명이 넘는다. 올해 만화경 성장은 전체 회원 70%를 차지하는 10~20대 중반 독자 입소문이 기여한 것으로 나타났다. 만화경 대표 인기 콘텐츠 키크니 작가 ‘별일 없이 산다’부터 감자 작가 ‘대흉작 감자밭’ 등이 Z세대에 인기를 끌면서, 다른 연재 작품에 대한..."
"'아우터 맛집' 올리비아로렌, 올 매출 25% 껑충","https://www.sedaily.com/NewsView/26F1X3YLCE","서울경제","이밖에 도시적이고 세련된 이미지의 배우 이지아를 전속모델로 발탁해 20대 후반부터 50대까지 직장인 여성들의 팬덤을 이끌어냈다. 올리비아로렌 관계자는 "앞으로도 급변하는 패션 환경 속에서 올리비아로렌만의 감도 높은 디자인과 퀄리티를 바탕으로 소비자 니즈와 트렌드를 반영한 상품 포트폴리오를..."
