Title,Link,Press,Description
"[기자의 눈]보험의 ‘소비자 보호’ 목적이란","http://www.insnews.co.kr/design_php/news_view.php?num=81960&firstsec=2&secondsec=26","한국보험신문","대기업 총수가 살해당했다는 충격이 지역사회를 덮쳤지만 ‘오죽하면’ 엘리트 출신의 20대 청년이 자신의 인생을 포기하면서까지 대표를 살해했겠느냐는 가해자 옹호론이 확대되면서 전 세계에 큰 반향을 일으키고 있다. 이는 보험사가 보험금을 지급함으로써 수행하는 보험(保險)의 ‘소비자 보호’라는..."
"'올라프 라테' '70살 미피'...키덜트 "귀여움 테라피"","https://www.ytn.co.kr/_ln/0106_202412222316078990","YTN","[서라미 (20대)/ 서울 가양동 : 이거 미피 가방이랑 키링이고요.// 여기 달려 있는 건 미피 키링이에요. 아기 때부터 많이 봐 왔고 동심 때문에 좋아하는... 어른의 마음을 사로잡은 '키덜트 감성' 온라인 문화가 확산하고 추억을 회상하는 사회현상이 결합하면서 캐릭터 문화 소비를 주도 하고 있습니다. YTN..."
"[이영철의 美 증시 주간전망] 산타랠리 기대감, 매파적 FOMC 여진 넘을까...","http://www.fntoday.co.kr/news/articleView.html?idxno=341700","파이낸스투데이","하지만 주 후반에는 연준(Fed)이 선호하는 물가지표인 PCE(개인소비지출) 가격지수가 시장 기대치를 밑돌며 인플레이션 우려를 완화시키면서, 위험... 27일(금)에는 S&P/CS 20대 도시 주택가격지수가 발표되며, 주택시장의 가격 동향과 전반적인 경기 흐름을 가늠할 수 있는 자료로 주목된다. 한편, BofA의..."
"'올라프 라테' '70살 미피'...키덜트 "귀여움 테라피"","https://www.ytn.co.kr/_ln/0106_202412221721374295","YTN","[서라미 (20대)/ 서울 가양동 : 이거 미피 가방이랑 키링이고요.// 여기 달려 있는 건 미피 키링이에요. 아기 때부터 많이 봐 왔고 동심 때문에 좋아하는... 어른의 마음을 사로잡은 '키덜트 감성' 온라인 문화가 확산하고 추억을 회상하는 사회현상이 결합하면서 캐릭터 문화 소비를 주도 하고 있습니다. YTN..."
"12·3 계엄사태 이후 MZ세대의 달라진 보수 인식 | “‘보수는 악, 진보...","http://monthly.chosun.com/client/news/viw.asp?ctcd=A&nNewsNumb=202501100029","월간조선","정보를 소비하며, 정치와 사회 문제를 과거 세대와 다른 방식으로 접근하는 특징을 지니고 있다. 이전에는 정치에 무관심하거나 관심이 적은 경향이 강했지만 최근에는 ‘특정 이슈’나 ‘정책’을 계기로 목소리를 내는 경우가 점차 늘고 있다. 특히 이번 ‘윤석열 대통령 탄핵 시위’에서는 20대 여성..."
"하남시 경기침체・민생경제 회복 예산 355억원 투입","https://www.kgnews.co.kr/news/article.html?no=823515","경기신문","시는 내년 상반기 소비·투자 분야에 재정 355억원을 집행하고 우선 구매 재정 예산(사무관리비·자산취득비·재료비·시설비)의 60% 이상을 투입할... 겨울철 폭설에 대비한 도로 제설을 위해 주요 도로변 5개 권역에 제설 차량 20대를 투입해 동시 제설에 나선다. 이현재 시장은 “지역경제 활성화와 취약계층..."
"나만의 특별함을 찾아...20대가 독립서점을 찾는 이유","http://www.kwangju.co.kr/article.php?aid=1734838200777961375","광주일보","트렌드를 따라가기만 할 뿐만 아니라 새로운 트렌드를 주도하기도 하는 20대에게 도서에도 트렌드가 생겼다. 바로 ‘텍스트 힙’이다. 이는 글이나 읽을... 이들은 혼자서 즐길 수 있는 취미나 개인 맞춤형 소비를 선호하며 독립서점의 큐레이션과 개별화된 공간에 높은 관심을 보인다. 이처럼 사회적 변화와..."
"하남시, 내년 상반기 355억 집행…취약계층 우선 지원","https://www.munhwa.com/news/view.html?no=2024122201039927042002","문화일보","민생경제 안정을 위해서는 소비·투자 분야를 중심으로 재정 355억 원을 내년 상반기까지 신속하게 집행하기로 했다. 사무관리비·자산취득비·재료비... 겨울철 폭설에 대비한 도로 제설을 위해 주요 도로변 5개 권역에 제설 차량 20대를 투입했다. 이 시장은 "민생안정을 이룰 수 있도록 지역경제 활성화와..."
"하남시, 민생경제 회복 위해 재정 355억 신속 집행","http://www.metroseoul.co.kr/article/20241222500109","메트로신문","먼저 민생경제 안정을 위해 소비·투자 분야를 중심으로 재정 355억원을 내년 상반기까지 신속하게 집행한다. 관내 우선 구매 재정으로 책정된 예산... 겨울철 폭설에 대비한 도로 제설을 위해 주요 도로변 5개 권역에 제설 차량 20대를 투입해 동시 제설에 나서는 한편, 폭설 시 이면도로 제설 관리에 만전을..."
"국민 10명 중 9명 OTT 시청한다… 20대는 100% 육박","https://www.daejonilbo.com/news/articleView.html?idxno=2174355","대전일보","20대의 경우 OTT 이용률이 무려 99.6%에 달했고, 음악(80.1%), 만화·웹툰(50.3%)의 이용률도 높았다. 10대는 애니메이션(50.4%)과 캐릭터 구매(19.4%)에서 두드러졌다. 애니메이션 이용자 51%는 만화·웹툰을 함께 이용했으며, 만화·웹툰 이용자 21.7%는 캐릭터 상품 소비를 병행한다고 응답해, 콘텐츠 연계..."
"하남시, 민생경제 회복 재정 355억 신속 집행…민생안정 특별대책 발표","https://www.viva100.com/article/20241222500298","브릿지경제","먼저 민생경제 안정을 위해 소비·투자 분야를 중심으로 재정 355억원을 내년 상반기까지 신속하게 집행한다. 관내 우선 구매 재정으로 책정된 예산... 겨울철 폭설에 대비한 도로 제설을 위해 주요 도로변 5개 권역에 제설 차량 20대를 투입해 동시 제설에 나서는 한편, 폭설 시 이면도로 제설 관리에 만전을..."
"2025년 주목할 클래식 내한공연들 (상)","https://www.newsverse.kr/news/articleView.html?idxno=6730","뉴스버스","결국 이렇게 접하기 시작한 감상자들을 적극적 음악소비자로 이끌어낼 마케팅이 절실해지는 단계다. 한편 부천시향을 위한 전용 클래식공연장이... 불과 20대에 오슬로 필하모닉, 파리 오케스트라, 세계최정상의 로열 콘세르트허바우의 상임지휘자에 오른 핀란드 출신의 천재 메켈레는 현 KBS교향악단..."
""내년 경제 어렵다" 하남시, 내년 예산 상반기때 신속 집행","https://www.asiatoday.co.kr/view.php?key=20241222010012127","아시아투데이","민생경제 안정을 위해서는 소비·투자 분야를 중심으로 재정 355억원을 내년 상반기까지 신속하게 집행한다. 지역내 우선 구매 재정으로 책정된 예산... 겨울철 폭설에 대비한 도로 제설을 위해 주요 도로변 5개 권역에 제설 차량 20대를 투입해 동시 제설에 나서는 한편 폭설 시 이면도로 제설 관리에 만전을..."
"국민 10명 중 9명은 OTT 본다…20대는 100% 육박","http://www.inews24.com/view/1796614","아이뉴스24언론사 선정","젊은 층의 콘텐츠 소비가 두드러졌다. 20대는 OTT(99.6%)와 음악(80.1%), 만화·웹툰(50.3%)의 이용률이 높았으며, 10대는 애니메이션(50.4%)과 캐릭터 구매(19.4%)에서 두각을 나타냈다. 애니메이션 이용자의 51%가 만화·웹툰을 함께 소비했으며, 만화·웹툰 이용자의 21.7%는 캐릭터 상품 구매를 병행한다고..."
"'올라프 라테' '70살 미피'...키덜트 "귀여움 테라피"","https://www.ytn.co.kr/_ln/0106_202412220731044093","YTN","[서라미 (20대) / 서울 가양동 : 이거 미피 가방이랑 키링이고요. 아기 때부터 봐왔고 동심도 있고 캐릭터도 엄청 귀엽게 생겼잖아요. 엄마는 다 컸는데... 감성' 온라인 문화가 확산하고 추억을 회상하는 사회현상이 결합하면서 캐릭터 문화 소비를 주도 하고 있습니다. YTN 이광연입니다. 촬영기자 : 박재상"
"“車 좋네, 너 성공했구나”…고향갈 때 타고 싶은 ‘금의환향’ 제네시...","https://www.mk.co.kr/article/11198382","매일경제언론사 선정","세단 대신 기아 쏘렌토와 스포티지 등 SUV를 구매하는 소비자들이 많은 상황에서 이례적이죠. ◆F=Father, Family 제네시스 G80 판매성공에는 아빠... 그 다음으로 40대(15.7%), 60대(14.4%), 30대(12.9%), 20대(12.5%), 70대 이상(11.8%), 10대 미만(6.9%) 순이죠. 인구가 많은 40~60대는 자동차 시장에서도 영향력이 가장..."
"동전 넣고 간절하게 드르륵…2030 여성 '동그란 캡슐' 열광 왜 [비크닉]","https://www.joongang.co.kr/article/25301836","중앙일보언론사 선정","이들이 현재 가챠 소비의 70%를 차지합니다. 일본의 게임유통사 ‘해피넷’은 성인 여성 절반 이상(20대 51.9%, 30대 50.3%)이 어른이 된 뒤 가챠를 구매했다는 조사를 발표하기도 했죠(2023년 ‘캡슐토이 성인 수요 실태조사’). 상품 구성의 다양화도 여성들이 가챠에 열광하는 이유입니다. 시작은 2012년 등장한..."
"하남시, 민생경제 회복위해 내년 상반기 재정 355억원 집행","https://www.newspim.com/news/view/20241221000076","뉴스핌","우선 민생경제 안정을 위해 소비·투자 분야를 중심으로 재정 355억원을 내년 상반기까지 신속하게 집행한다. 관내 우선 구매 재정으로 책정된 예산... 주요 도로변 5개 권역에 제설 차량 20대를 투입해 동시 제설에 나서는 한편, 폭설 시 이면도로 제설 관리에 만전을 기할 수 있도록 14개 동 행정복지센터에..."
"하남시, 재정 355억 신속 집행…민생안정 특별대책 발표","https://www.moneys.co.kr/article/2024122109042242252","머니S","먼저 민생경제 안정을 위해 소비·투자 분야를 중심으로 재정 355억원을 내년 상반기까지 신속하게 집행한다. 관내 우선 구매 재정으로 책정된 예산... 겨울철 폭설에 대비한 도로 제설을 위해 주요 도로변 5개 권역에 제설 차량 20대를 투입해 동시 제설에 나서는 한편, 폭설 시 이면도로 제설 관리에 만전을..."
"이현재 하남시장, 민생경제 회복 재정 355억 신속 집행…민생안정 특별...","https://www.ajunews.com/view/20241221135613036","아주경제","먼저 민생경제 안정을 위해 소비·투자 분야를 중심으로 재정 355억원을 내년 상반기까지 신속하게 집행한다. 관내 우선 구매 재정으로 책정된 예산... 겨울철 폭설에 대비한 도로 제설을 위해 주요 도로변 5개 권역에 제설 차량 20대를 투입해 동시 제설에 나서는 한편 폭설 시 이면도로 제설 관리에 만전을..."
"편의점서 3000원에 팔더니 초대박…"다이소 갈 필요 없네"","https://www.hankyung.com/article/2024122113957","한국경제언론사 선정","이와 함께 '가성비'가 젊은 층들의 소비를 이끌어내고 있다. CU의 화장품 매출을 연령대에 따라 살펴보면 10대가 42.3%, 20대가 32.3%를 차지했다. GS25에서도 올해 1월부터 11월까지의 화장품 카테고리 매출 중 1020세대가 차지하는 비중이 59.4%에 달했다. 이른바 '잘파세대'라고 불리는 연령층이 소비를 이끌고..."
"하남시,민생경제 회복 355억원 신속집행 민생안정 특별대책 발표","http://www.seoulwire.com/news/articleView.html?idxno=631710","서울와이어","먼저 민생경제 안정을 위해 소비·투자 분야를 중심으로 재정 355억원을 내년 상반기까지 신속하게 집행한다. 관내 우선 구매 재정으로 책정된 예산... 겨울철 폭설에 대비한 도로 제설을 위해 주요 도로변 5개 권역에 제설 차량 20대를 투입해 동시 제설에 나서는 한편, 폭설 시 이면도로 제설 관리에 만전을..."
"‘미투’의 반란...‘레드불-몬스터’의 에너지 드링크 전쟁[허태윤의 ...","https://economist.co.kr/article/view/ecn202412170024","이코노미스트언론사 선정","레드불의 성공을 낱낱이 분석한 결과, 18세에서 20대 초반의 타깃을 위해 단순한 물리적 혜택인 ‘각성’을 뛰어 넘어 심리적 혜택인 ‘반항아적... 특히 분홍색 캔의 ‘파이프라인 펀치’는 에너지 드링크를 꺼리던 여성 소비자들을 사로잡는 데 성공했다. 캔 디자인에도 반항적 메시지를 담았다. 날카로운..."
"‘편의점·다이소’ 달려가는 10·20대… ‘올리브영’ 독주 위협","https://www.asiatime.co.kr/article/20241220500293","아시아타임즈","CU의 화장품 연령별 매출 비중을 보면 10대가 42.3%, 20대가 32.3%로 잘파세대의 비중이 70% 이상을 차지하고 있다. 세븐일레븐도 올해(1/1~12/19) 화장품... 류주희 GS25 라이프리빙팀 상품기획자(MD)는 "합리적이고 스마트한 소비 니즈를 반영해 가성비 화장품 확대 프로젝트를 시작했다"며 "앞으로 더..."
"“커피값까지 올라 부담 되시죠?”…225원의 행복 [일상톡톡 플러스]","http://www.segye.com/newsView/20241220501789?OutUrl=naver","세계일보언론사 선정","부산에 사는 20대 1인 가구 이모 씨는 최근 생활비 부담을 느끼면서도 커피만큼은 포기할 수 없었다. 그는 중고 거래 앱을 통해 저렴한 가격에 커피 머신을... 이에 따라 소비자들이 집에서 저렴하게 커피를 즐기는 ‘홈카페’ 트렌드가 확산되고 있으며, 이를 겨냥한 커피업체들의 움직임도 활발하다. 20일..."
"디자인·소재·봉제 ‘올 인 K’…K패션 프리미엄 높인다","https://www.joongang.co.kr/article/25301738","중앙SUNDAY","대기 줄 맨 앞에 선 4명의 남녀 20대 직장인들은 전날 저녁 9시부터 약 14시간 동안 오픈을 기다리고 있다며 “이 브랜드는 실루엣, 디자인이 굉장히... 시부야 파르코 백화점에서 운영된 ‘쿠어’의 팝업 스토어 매장 매니저는 “한국에서 쿠어 제품을 보고 구매해 본 경험이 있는 일본 소비자들의 방문이..."
"“퐁퐁남이 여혐이라고? 억울하다 말도 못하나 페미니즘 해도 너무해”","https://www.chosun.com/national/weekend/2024/12/21/CM27ZWIHCBAU3MU465ACMBJ4PM/?utm_source=naver&utm_medium=referral&utm_campaign=naver-news","조선일보언론사 선정","소비층은 문화 소비가 활발한 10~20대 여성입니다. BL을 그리지 않으면 돈을 벌 수 없을 정도예요. 전 개인적으론 싫어하지만, 제자들이 BL을 그려오면 ‘남자를 더 예쁘장하게, 어깨 더 벌어지게 표현하라’고 했어요. 그게 시장 논리니까요.” -그러다 왜 여성 독자를 화나게 할 웹툰을 그린 거예요? “상대의 성..."
"하남시, 민생경제 회복 재정 355억원 신속 집행","https://view.asiae.co.kr/article/2024122023153776189","아시아경제","먼저 민생경제 안정을 위해 소비·투자 분야를 중심으로 재정 355억원을 내년 상반기까지 신속하게 집행한다. 관내 우선 구매 재정으로 책정된 예산... 겨울철 폭설에 대비한 도로 제설을 위해 주요 도로변 5개 권역에 제설 차량 20대를 투입해 동시 제설에 나서는 한편, 폭설 시 이면도로 제설 관리에 만전을..."
"‘먹는 수돗물’로의 패러다임 전환, 서울아리수본부 ‘아리수’ 원년...","https://www.dailyt.co.kr/newsView/dlt202412200018","데일리환경","또 11월에는 서울시민 1천 명을 대상으로 실시한 ‘서울시민 먹는 물 소비패턴 조사’ 결과 발표를 통해 서울시민의 수돗물 먹는 비율이 49.6%로... 본부는 수돗물을 마시는 비율이 20대 이하를 포함한 젊은 세대일수록 낮아지고, 먹는 샘물 구매 비율이 높아진다는 점에 착안해, 2030세대를 대상으로 기존..."
"[인터뷰] 이종욱 백조씽크 대표, "100년 명문 기업 될 것...장수 강소기...","http://www.newsian.co.kr/news/articleView.html?idxno=75585","뉴시안","이러한 다양한 20대의 경험이 지금의 경영에 어떠한 영향을 미치나요? - 전국 오지를 돌며 싱크대 수리와 설치를 맡아 소비자의 불만을 직접 들으며 밑바닥부터 경험해보라는 아버지의 뜻으로 시작했던 일이 지금 생각해보면 경영에 가장 큰 도움이 되었다. 예전과 달리 지금은 소비자가 니즈를 바탕으로 씽크볼..."
"남원시 "2024년은 역대 최고 공모사업 선정…잠재력 높은 강소도시 입증...","https://www.pressian.com/pages/articles/2024122021153372295?utm_source=naver&utm_medium=search","프레시안","먼저 국립 유소년 스포츠콤플렉스 조성사업은 제20대 대선 전북 지역공약사업을 남원에 유치한 국가사업으로 제2의 양지인 선수를 육성할 유소년첨단... 실제로△‘2024 전국 기초단체장 공약이행 및 정보공개 평가‘최우수 (SA)’선정 △상반기 신속집행 및 소비투자 추진 실적‘1분기 최우수기관’ 선정..."
"헛소리 거를 '마법 단어'…챗GPT, 제대로 쓰는 법 싹 모았다","https://www.joongang.co.kr/article/25301696","중앙일보","팩플은 소비자·투자자 입장에서 알아야 할 혁신 기술과 비즈니스에 대한 모든 것을 다룹니다. 더 자세한 내용은 더중앙플러스 구독 후 보실 수... 조장, 시험 준비를 위해 인공지능(AI)에 노트를 요약해달라는 취업준비생. 요즘 20대들이 AI 쓰는 법을 모았다. https://www.joongang.co.kr/article/25269354"
"이현재 하남시장 “민생안정 이룰 수 있도록 모든 행정력 총동원하겠다...","https://biz.heraldcorp.com/article/10020515?ref=naver","헤럴드경제","먼저 민생경제 안정을 위해 소비·투자 분야를 중심으로 재정 355억원을 내년 상반기까지 신속하게 집행한다. 관내 우선 구매 재정으로 책정된 예산... 겨울철 폭설에 대비한 도로 제설을 위해 주요 도로변 5개 권역에 제설 차량 20대를 투입해 동시 제설에 나서는 한편, 폭설 시 이면도로 제설 관리에 만전을..."
"하남시, 민생경제 회복 재정 355억 신속 집행","https://www.seoul.co.kr/news/publicnews/local_govern/news_local/2024/12/20/20241220500215?wlog_tag3=naver","서울신문","먼저 민생경제 안정을 위해 소비·투자 분야를 중심으로 재정 355억원을 내년 상반기까지 신속하게 집행한다. 관내 우선 구매 재정으로 책정된 예산... 겨울철 폭설에 대비한 도로 제설을 위해 주요 도로변 5개 권역에 제설 차량 20대를 투입해 동시 제설에 나서는 한편, 폭설 시 이면도로 제설 관리에 만전을..."
"하남시, 민생경제 회복 재정 355억 신속 집행…민생안정 특별대책 발표","http://www.inews24.com/view/1796573","아이뉴스24","먼저 민생경제 안정을 위해 소비·투자 분야를 중심으로 재정 355억원을 내년 상반기까지 신속하게 집행한다. 관내 우선 구매 재정으로 책정된 예산... 겨울철 폭설에 대비한 도로 제설을 위해 주요 도로변 5개 권역에 제설 차량 20대를 투입해 동시 제설에 나서는 한편 폭설 시 이면도로 제설 관리에 만전을 기할..."
"이현재 시장, "민생안정·지역경제활성화·취약계층지원에 모든 행정력...","http://www.fieldnews.kr/news/articleView.html?idxno=10577","필드뉴스","먼저 민생경제 안정을 위해 소비·투자 분야를 중심으로 재정 355억원을 내년 상반기까지 신속하게 집행한다. 관내 우선 구매 재정으로 책정된 예산... 겨울철 폭설에 대비한 도로 제설을 위해 주요 도로변 5개 권역에 제설 차량 20대를 투입해 동시 제설에 나서는 한편, 폭설 시 이면도로 제설 관리에 만전을..."
"하남시, 민생경제 회복 재정 355억 신속 집행","http://www.g-enews.com/ko-kr/news/article/news_all/20241220172517565a141c47927_1/article.html","글로벌이코노믹","먼저 민생경제 안정을 위해 소비·투자 분야를 중심으로 재정 355억원을 내년 상반기까지 신속하게 집행한다. 관내 우선 구매 재정으로 책정된 예산... 겨울철 폭설에 대비한 도로 제설을 위해 주요 도로변 5개 권역에 제설 차량 20대를 투입해 동시 제설에 나서는 한편, 폭설 시 이면도로 제설 관리에 만전을..."
"1인 가구에서 늘어나는 가공식품 소비","https://www.newsfreezone.co.kr/news/articleView.html?idxno=601617","뉴스프리존","반면 식료품 소비는 남성보다는 여성 1인 가구에서 높게 나타났다. 혼자 사는 남성은 집에서 음식을 하기보다는 외식을 주로 하고 여성은 혼자 살면서도 직접 요리를 하는 성별 차이가 존재하는 것으로 보인다. 대한상의 리테일톡에 따르면 20대인 청년층이 가장 많은 돈을 지출한 카테고리는..."
"[현장] 아이레시피, 클린 뷰티 2.0 시대…“팝업스토어에서 체험하세요...","http://digitalchosun.dizzo.com/site/data/html_dir/2024/12/20/2024122080159.html","디지틀조선일보","평일 낮임에도 방문객들의 발길이 이어지며, 특히 20대 여성을 중심으로 다양한 연령층의 고객들이 팝업을 찾고 있다. 이번 팝업은 무신사뷰티와 협력해... 이번 팝업 스토어는 젊은 소비자층을 타깃으로 직접 체험의 기회를 제공하는 데 중점을 뒀다. 아이레시피 관계자는 “온라인 마케팅에 집중하던 기존..."
"세르비아 A to Z, 이것만 알면 나도 세르비아 전문가","http://dream.kotra.or.kr/kotranews/cms/news/actionKotraBoardDetail.do?SITE_NO=3&MENU_ID=180&CONTENTS_NO=1&bbsGbn=243&bbsSn=243&pNttSn=223757","KOTRA해외시장뉴스","이에 KOTRA 베오그라드 무역관은 다수의 세르비아 소비자와 인터뷰를 진행했다. 한국에 관심이 많은 20대 세르비아 여성인 A 씨와 B 씨가 꼽은 세르비아의 특징은 ‘이나트(Inat)’, ‘가족 중심의 문화’다. A 씨는 “세르비아인은 가족, 학교, 사회 시스템에 의해 연대와 이낫의 개념을 자연스럽게..."
"[르포] "배부른데 시식이 끝이 없네"… 마곡 코엑스 '컬푸페' 오픈하자...","https://www.pressman.kr/news/articleView.html?idxno=86580","프레스맨","" 19일 코엑스 마곡 르웨스트서 열린 컬리푸드페스타 2024 개막 첫날 행사장을 찾은 한 방문객(20대·여)은 "맛집을 발굴하는 중이다"며 이같이 말했다.... 소비자에게 현장 체험이후 편리한 온라인 쇼핑 경험을 통한 온·오프 시너지를 선보인다는 취지다. 19일 방문한 축제 현장에는 2배가량 커진 규모에도 부스와..."
"[주간 데이터동향] 국민 53% '내년에 소비 더 줄인다'…가계부 앱 이용자...","http://www.banronbodo.com/news/articleView.html?idxno=23581","반론보도닷컴","사용자의 소비 패턴을 다양한 차트와 그래프로 알기 쉽게 정리해주며, 간편한 사용법으로 많은 사랑을 받고 있다. 닐슨 코리안클릭 데이터에 따르면 뱅크샐러드의 월평균 활성 이용자 수(MAU)는 148만명, 편한가계부는 70만명에 달했다. 가계부 앱 이용자의 주요 연령대는 20대로, 전체 이용자의 32%를..."
"8000명 몰린 컬리푸드페스타...둘째날도 북새통","https://www.newstof.com/news/articleView.html?idxno=25561","뉴스톱","CJ제일제당 직원들은 자주색 슈트를 입은 진행요원으로 분장해 소비자들을 안내했다. '풀무원'도 방문객들이 부스를 둘러 줄을 설 만큼 큰 인기를... 이날 행사장 방문객은 컬리의 주요 고객층인 30~40대들이 주를 이뤘고, 20대와 40~50대들도 종종 볼 수 있었다. 한 50대 여성은 "평소에 컬리를 즐겨 쓰면서 크게..."
"[르포] 컬리가 만든 크리스마켓 '컬리 푸드페스타 2024'...오감만족 충분...","http://www.popcornnews.net/news/articleView.html?idxno=70478","팝콘뉴스","돌리는 소비자들은 이벤트를 통해 받을 수 있는 상품 등에 눈길을 떨어뜨리지 못하며 발걸음을 옮기기도 했다. 또한 푸드페스타인 만큼 이를 처리하는 쓰레기 문제도 무시할 수 없다. 지난해보다 좀 더 촘촘하게 배치한 쓰레기통에도 재활용 문제가 대두됐다. 서울에서 연인과 함께 방문한 20대 여성은 "어?..."
"퍼니준, '휴먼 업사이클링' 전시 통해 '지속가능한 소비' 메시지 전달","https://www.the-pr.co.kr/news/articleView.html?idxno=52672","THE PR","질풍 노도: 20대의 감정과 군대 시절 친구들과의 교류를 담은 작품. 로맨스 포 저니: 출장과 여행에서 얻은 비행기 티켓으로 설렘을 표현. 물건은 내 친구: 일상 속 물건들을 삶과 영감의 원천으로 조명. 퍼니준은 "물건은 단순한 도구가 아닌, 우리의 기억과 감정을 담은 자아의 일부"라며, "이번 전시가 소비를..."
