title,content,date
2024 recap,"[     안녕하세요2024년도를 돌아보려 합니다 !2025년이 된 지 좀 지나긴 했는데사실 1년치 블로그 쓰려니까 시간이 좀 걸렸어요읽어달라하기 민망할정도로 김... 럴수럴수이럴수가그냥 읽은척하고 댓글 다셔도 봐드릴게요? ㅎㅎ                    시작할게욤                           이때쯤에 푸딩팝업행사알바를 했었는데 (인생첫알바!!)맨날 마감때마다 남은 푸딩을 50개씩 집에 들고와서친구들한테 나눠줬어요 ㅎㅎ완전 푸딩수저였는데                           강아                                그리구 겨울엔 따숩차를 엄청 많이 마셨음조금씩 홀짝홀짝 . . . . 아주많이                                이날은 !!! 승은이네 동네가서 건대탐방하구 이자카야가서 인당 10만원인가 쓰고 나온날인데요...승은이가 과대추첨당첨될까봐 무섭다더니심박수가 150까지오름 미친저는 앞에서 얘가 진짜 갑자기 펑 !! 하고 터질까봐 개무서웠는데 추첨 안되니까 원래대로 돌아오더라구요?웃기당                                가람이가 죄수성공하고 암흑의 의대생이 되어 돌아왔는데요?네 그렇습니다저는 사실 문제많던자퇴생출신이라..(절대아님)동창이라고 할만한 애들이 정말 쟤들이 다라서니들이 참 소중하고 그런데 너네는 어때 너네두 내가 소중해? 그런데 왜 솔탈했어?                    별이 참~ 많던 수련회그립다 ^_^                           이때즈음부터 ! 저희 동네에 출몰한 개냥이가 있는데요진심 저희집 고양이들보다 저에게 친절해서제가 참 좋아합니다                           이날 바이블캠프였나? 그런걸 했는데안가려다가 갑자기 언니들도 넘 보고싶구 그래서생얼로 머리도 안감고 막 뛰어가서 언냐들 보고왔어요                                제가 제~일 좋아하는 여자들 ㅎㅎ이랑 홍대에서 오타쿠놀이한날@: 연애하기 제일 힘든 조합이긴 해.....                                 2-1 ❤️이때 막내라고 참 예쁨 많이 받았는데 (지금도 사실 어디가서 언니노릇 하고있진 못하지만 ^^) 제가 왜벌써 이렇게 늙어버렸을까요?                           은혜언니랑 놀면 늘 9살로 돌아간것 같음 (오바조금보태서 )올해는 은혜언니가 한국에 있어서 너무 든든하고 즐거웠어요언니가 미국에 안갔으면 좋겠는데언니 여권 다 찢어서먹어버리고 못하게 하는건 너무 철없는거겠죠....................... 슬프다                           우리 엄마는 프리지아? 꽃을 참 좋아하는데그래서 아빠가 늘 프리지아철? 이 되면 저 꽃을 사와요엄마가 꽃을 좋아하니까 아빠는 저도 꽃을 좋아할거라 생각하는지 가끔 꽃다발을 사다주는데사실 저는 꽃선물은 딱히 안좋아해요 (미안)그래도 아빠가 사다주면 ㄱㅅ!!!! 합니다 한다음 엄마시켜서? 방에 예쁘게 꽃아놓는 답니다?저희 가족 로맨틱하죠?                           현우오빠가 카메라로 찍어준 우리너무 사랑하고 정말 너무 보고싶음 이 여자들이                                                                    은혜언니랑 간 경주여행 올해만 경주를 2번이나 갔는데요저는 역사, 유적지, 이런거 너무 좋아해서경주가 너무 좋아요 근데 경주에 갈때마다 비가 조금씩 왔는데경주는 흐린날 유독 예쁜거 아시나요? 그래서 투쁠러스로 좋았어요~                           이때즈음엔 토요일마다 늘 교회가서 성경공부하고 여자들이랑 잼얘하고 놀았는데재밌겠당 ㅋㅋ 또 교놀하고싶다 (교회에서 놀기)                    강아 (못생김)                                                  이날은 제 생일 ! !동생이랑 이태원가서 전시보고 엘피 듣고 놀다왔어요                                글구 친구들이 추카해준 생일 . . . .                                또.... 추카받은 생일 생일추카를 정말 100개 받았네요전 사실 생일을 막 좋아하고 그런사람이 아닌데 올해 유독 여기저기 추카를 많이 받아보니까 좋더라고요 !!!!?또 생일하고 싶다 맨날맨날 생일하고 추카받고싶다 ㅎㅎ넘철없낭                                                  글구 개강을 했는데 정말 fucking너무힘들었음그래도 매일 버스에서 책읽구..... 돌아오는 길에 가장 좋아하는 빵집에서 곰돌이쿠키 사먹고 그러면서 버텼습니다                                그리고 주윤이랑 매주 카페드림 아이스크림 사먹음이번년도 쥬쥬없었으면 어케 버텼을까요?  오타쿠talk해줄사람도없고... 코퍼스욕할사람도없구.......참 좋은 사람 ^^***                           저를 버리고 호주로 떠나버린 쏘니랑도 자주 만나서 놀았는데용쏘니랑은 참 닮은점이 많고 ....... 맨날 만나서 저 넘어진 이야기만 100번하지만 그게 참 재밌음소은이가 호주에가면 저는 정말 학교에 혼자남아 참 외롭고 죽고싶고? 그러겠지만 ~ 그래도 작고소중한소은이가 잘지냈으면 좋겠어요 소은아 거기서도 행복하렴 !!                                학교끝나고 노들섬 간날정말 많이 먹었다 밤새먹음너무 추웠고 그래도 사진 많이 찍었다                           제가 엄청 좋아하는 조합인데이 다섯중 지금 학교에 남은 사람이 나밖에없음언제쯤 돌아와줄래???????? (웃긴점. 내년엔 나도 없음)                                이날은 ~ 부활절이라 예쁘게 꾸미고 가구이쁜 사진 많이 찍고 ㅎㅎ엄마가 집에오는길에 봄이 왔다면서 꽃을 꺾어다 준날 ~ 이라 기억에 남네용                                글구 벚꽃이랑 사진도 마니 찍었어욤 ㅎㅎ벚꽃피면 참 기분별로던데이번 벚꽃은 유독 좋았네요?                                그리고 머리 자르고 핑크로 염색했는데 ㅎ.......너무 레이디가가같고 ㅜㅜㅋㅋ 그래서 창피했움...근데 나중에는 다들 예쁘다 해줘서 기분 좋았어요 (?)                                우리 강아랑 처음 맞던 벚꽃철 강아에게 예쁜 꽃을 많이 보여주고 싶어서산책을 하루에 막 2번씩 했는데강아도 좋아했겠죠?                                덩경언니랑 놀고 집에 오는길에벚꽃잎을 잡았어요 !! 살면서처음잡아봄근데 아무일도 안일어나서그냥 다시 뚜벅뚜벅 열심히 걸었습니다                                                  엄마랑 강아 셋이서 꽃놀이도 갔는데요?벚꽃이 엄청 잘보이는 자리를 잡고 사람도 얼마없구 그래서완조니 행복만 가득했고 강아도 좋아했을거에요 ㅎㅎ내년 벚꽃도 같이 보는거얌                            이날은 ! 중간고사 끝나고 냅다 선우 불러서선우가 벗어준 잠바입고 센파 산책한날 이날 저희의 아지트 카페를 찾아서 이날 이후로도 자주 갔어요어딘지는 안알랴줌 ㅎㅎ 바나나푸딩이 짱맛인데                                기여운 강아랑 날씨 좋을때 산책을 마니 해야한다는 생각에정말 매일같이 산책을 함 강아야 ! 날씨 풀리면 또 언니랑 산책가자                                이때 너무너무 모종의이유로 괴롭던 교양수업이 있었는데요......걍 너무 강의실에 들어가기도 버거워서 이날은 자휴한다음친구들이랑 청계천에 놀러갔어요 ㅎㅎ친구들이 궤롭..던 시기에 많이 위로해주고! 같이욕해주고! 다죽자고하면 죽어주고!(아님) 그래서 넘 따수운 기억이~ 흑흑 감동이다                                봄에 읽던 책여기 수록된 새 어쩌고 소설이 너무 재미있었거든요근데 읽다가 갑자기 남자주인공이 반인반수 새였음. 이래서개놀람 네???? 남자주인공이 사람이 아니라고요?                           즐거웠던 수양회하콩이 너무 좋았던 수양회그랬던... 수양회                                학교 축제도 열심히 놀았네요삐에로 열심히 찾아다니면서 결국 풍선도 뜯어냈어요                                선우가 행궁동에 너무 가보고 싶다고 해서 데려갔어요같이 커플팔찌도 맞추고 이것저것 했음                                                  이때 즈음에 할게 너무 많았는데 너무너무정말죽도록 !!! 하기싫어서 매일을 분좋카로 회피하듯.......도망쳤고 책을 참 많이 읽었는데요.........그래도 결국 할일을 다 해치우고 다시 제자리로 돌아올 힘은 늘저기서 얻었던 기억이 있습니다                                은혜언니랑 대왕리본룩입고 대학로에서 재밌게 놀았던 기억 thanks !!! 😘 you made my day                                                                    이때는 파스타에 빠져서 매일.매일.정말 매일. 파스타를 먹고파스타만 먹기 그러면 술사와서 같이먹고. 와인먹으면서 과제하고. 캔맥주 맨날 사와서 영화보면서마시고. 그랬는데 지금보니까 진짜 제정신이 아닌것같죠?                                 파랑머리를 함이때 이후로 머리카락이 기하급수적으로 사망을 했습니다이제 삭발만이 답 T T ~                                엄마가 서울갈줄모른다고 해서 엄마데리구 서울도 갔는데엄마가 사람많아서짜증나니까 집가자고 해서 걍 다시 집온날도 있어요 하..엄마딸 착하지? ^^                           비가 온다구 했는데 너무 화창해서 마른 장화를 신고 서울숲 돌아다닌날그리고 엄청 귀여운 오니기리를 머금 참 기억에 남네요?                           올해 청계천에서 야외도서관행사를 했던 거 아시나요?저도 혼자서 뚜벅뚜벅 걸어가 행사에 참여를 했는데요.....청계천에 읽던 책을 담궈버림 (실화)진짜 너무 창피해서 줍지도 못하고 둥둥 떠내려가는 책을 바라보고만 있었는데 모르던 분이 엄청 놀라시더니 건져서 가져다주셨어요.. 그래서 그자리에서 말린다음 다시 읽었습니다죽지도 않고 돌아온 책은 정말 강하구나                                시험기간 ㅎㅎ 에 공부안하고 맨날캠스터디 들어사서 아이스크림 먹었더니 성적이 진짜 멸망을 했습니다 평균 4점대로 goback 가능한가? 솔직히 모르겠고 이젠 자퇴만이 답인것같기도 하지만 화이팅 ^^ !!!                                이때 아웃백 알바를 시작했는데제가 개복치라 너무 힘들어서 2달만에 run 함그리고 엄마한테 그냥 맨날 돈달라고 했어요 (ㅠㅠ)너무 무능력한 딸같아서 ...... 미안하긴 하지만계속 이렇게 살래                                알바런하고  방학 매일같이 한일바게트 빵 사와서 잼발라먹고 강아랑 누워서 푸데푸데커어어                           그리고 옥상에서 엄마가 텃밭 가꾸는거 구경하면서 광합성 하기제가 제일 좋아한 시간인데요저때 엄마가 심심하다고 재밌는 얘기 해달라고하면 it's my time 한다음 엄청나게 말을 많이 해주면 됩니다완전 좋은 시간이죠? 강아뷰 고양뷰도 있고 넘 좋은듯 ? ㅎㅎ                    이날은 제가 엄청 좋아했던 날인데요하은언니가 모르는개산책 해보고 싶다고 해서야밤에 우리 강아랑 산책 시켜줌 강아가 이쁨받아서 너무너무 기분 좋았어요                                여긴 명동에 헬키가 정말 엄청 많았던 초밥집인데 정말 웃겼던건 어떤 남자 둘이 일반 초밥집인줄 알고 와서 엄청 욕하면서 초밥을 먹고감..헬로키티 그릇이 하나씩 나올때마다 서로 야뒤질래진짜? 이럼                           하콘이랑 성수 데이트 한날 귀여운 하콘강아도 보고 정말 즐거웠다하콘아 우리 또 보자 ! 안본지 1억광년이 지나써                                절거웠던 ~ 2나번째 경주여행은 이미 블로그 써서 따로 안쓸게욤                                                  그리구 펜타포트감 !!이당시 저의최애밴드 웨이브투얼th 를 봤고요이날 턴스타일?무대가 진짜 개미친꿀잼띠었다는데저희는 너무 덥고 지쳐서 걍 안보고 집갔습니다사실 전 밴드덕후 선우에 비하면 ? 밴드알못이긴한데요 ?걍 시끄럽고 신나는거 너무 좋아서 또 가고싶어요내년에는 3일권 끊어서 가려고요 ㅎ.ㅎ ~ ~ ~                                 그리고 워터밤도(...) 감화장 1시간 들여서 엄청 열심히 했는데오엠쥐.. 앞뒤로 물을 엄청 쏘는 바람에그냥 물젖은쥐.물젖은쥐. 가 된 채로 6시간 스탠딩 뛴 사람이됨이쁘게 찍은 사진도 없네요그래도 이거 너무 재밌다 내년에 또하죠?                                예인이랑 하이큐 보고 홍대간날제가 스포츠물을 너무너무너무정말너무 좋아하는데 (프리,슬덩.갑타 이런거 조아함)하이큐는 사실 그닥.. 제스타일은아니거든요. 근데 동생이너무좋아해서 걍 같이봤습니다. 내용도잘기억안남^_^;;(참고로 동생은 극장판 8번봄)                                여기는 제가 올해 가장 좋아했던 공간 중 하나인데요특이한 책이 많고 책방지기님이 웃수저인 책방 !근데 약수역이 너무 멀어서 가끔씩만~ 감 ㅠㅠ도망친 곳에 낙원 같은 곳이라 힘들때마다 가줍니다                     너무너무 즐거웠던 여름 소설중 하나네요올 여름가을에는 책을 참 많이 읽었어요그냥 모든것으로부터 회피한 그 시간이 좋아서 . . . . . . . . . .                                 이날도 정말 좋았던 이유는너무너무 제가 좋아하는 친구 아오랑 서로 편지써주고, 비즈놀이하고, 선물 교환식하고, 서점 놀러가고 그랬거든요 ?그 시간이 너무 좋았어요 . . 취향이 비슷한 사람과의 만남은 늘 좋은느낌을 줌                                                  승은이랑 집 옥상에서 하는것.........                           여름에는 늘 제철과일을 사와서 아삭아삭 씹어먹으며잠옷입구 비즈놀이를 해야했던?^^ 이게제여름감성이랍니다?                           그리고 2학기 개강을 했는데정말 개바빴고 너무 힘들었음(이정도면 개강이 적성에 안맞는거임...ㅠㅠ)                                그리구 !! 저희 학교 도서관에서 제 최애 고전 작가인 카프카 전시회를 했거든욤 ㅎㅎ? 밤공부 끝내고 오는길에 구경했는데역시역시역시나.....카프카는 내생각이상으로 ㅁㅊ놈이야 라는 피드백드립니다?                                                       대학생 학대                           카프카 단편집을 완독...못하고반의반의반의반독?ㅋ 정도 했던 추석연휴                                그리고 쿨링 기능이 있는 기능성 티를 구매한 강아...너무 귀엽다.................윽...쿨럭쿨럭..올해 추석 너무 더웠죠?지구가 많이 아픈가봐요. 아프지 않도록 기도합시다?                                이런거 너무 많이 했네요내년에는 자제하겠습니당 (절대자제할생각없음)                                             이 글은 다시 읽어봐도 참 좋아서 공유합니다 같이 읽어봅시다(근데 이거 사진을 한줄에 3개 넘게는 못넣나요? 다들 블로그보면 그렇게 하던데 어떻게 하는지 아시는분 좀 알려주길)                           이때 즈음부터 처서 magic .. 정말 기하급수적으로 시원해져서러닝을 뛰기 시작했어요 저 이제 10키로도 거뜬하게 뛰는 요자임요 ㅋㅋ(사실그정돈아님) 다붙자                                              내가 너무너무 좋아했던 햄릿수업그리고 그 중 가장 좋아했던 오필리아 파트                                       이날은 좋아하는 은혜언니랑 제가 좋아하던 문래동에 갔는데요?길가다가 양말트럭 자만추하고 양말 10개삼                                수상한 카페에 가고 (너무조았둠), 키티템 겁나~ 사고, 수제맥주집갔다가 ,  ,, 공연장 가서 공연도 보고 ㅎㅎ 너무 좋았던 날 중 하나로 기억하고 있습니다 돌아가는 길이 외로웠을만큼!                           아오랑 교환한 안미옥시인의 시집 - 나는 &lt;여름외투&gt;를 줬음... 밑줄 벅벅 그어진... - 여름 내내 뽈뽈뽈 돌아다니며 읽었어요 ㅎㅎ다 읽어갈때즈음엔 어느새 가을이 물씬 왔던 !!                                그리고 이때즈음에 헬키가방을 구매해서 잘 들고 다녔습니다(@: 너만 들고 다닐수 잇는 가방이긴해...)                                즐거웠던 나메코 팝업 ^^  올해는 나메코가 대한민국에 상륙했다는점에 있어서 아주 큰 의미가 있는 해입니다 ㅎㅎㅎ.... 균권운동부활시키자 ~                    엄청 맛없었던 수제 케이크 ㅠㅠ ㅋㅋㅋㅋㅋ 그치만 축하해욤                           가을이 성큼 !~~~~~~~~~                                                  선우랑 카공하구 피크닉함이때즈음에 제가 피크닉에 빠져서 맨날 돗자리 들고다니면서 피크닉하고 그랬슨데요, 저날 마켓 사진도 찍고 (근데 아직도 업로드안함 ㅁㅊ것) , 누워서 책읽고, 안선우가 이상한말하는거 듣고, 인형뽑기해서 인형 3개뽑음                           학교 코스모스 이뻐 (사진에 안담김ㅠㅠ)                                                  이날도 !! 동생이랑 피크닉을 했어요한강까지 가서 피크닉했는데 라이딩하는사람이 너무 많아서 나두 라이딩 하고싶어서 ㅎㅎㅎㅎ 자전거 가격까지 알아봄.........흐아아아아 합정 살고싶다 TT                           우산을 들고 나왔는데 우산 손잡이가 없었던 일에 대하여 ..                                새벽까지 공부하구.... 잠안오면 나가서 뛰고 들어와서 자고 그랬슨^^;;; 관념적갓생러 (실질적으론 x)                                             길가면서 젤라또먹고, 강아풀 구경하고 (색이 참 다르죠?)                           마라톤도 나갔어요 ~ !!!!! 물론 기록은 못세웠지만 ^^ ㅎㅎㅎ 정말 재밌었고, 정말 나도 한강세권. 살고싶었고........ 25년에는 3월에 10키로로 한번더 나가고 가을까지 하프 나가는게 목표랍니다? 달려                    앗차, 그리고 올해는말차에 빠졌어요... (진짜갑자기)평생 말차를 못먹던 제가 말차를 먹게된것 아주 큰일이죠???? 방금도 말차마카롱 먹음                           문동팝업도 갓는데요저날 참 우울했는데 아오한테 꽃선물을 받아서 참으루, 행복했던 그런 기억이 잇읍니다............. 시집도왕창구매                                수업 공강때 도서관가기 개ㅐㅐ싫어서솔찬가서 혼자 누워서 잠 (심지어 진짜 개쿨쿨 잠......)꿀잠자고 일어나서 새구경하고 책좀 읽고 그랬는데솔찬공원에 사람이 왤케없죠?? 처음알았네쨌든 조았고요 다들 츄라이 해보시길 ㅎㅎ                           ...                                합정에서 분좋바두 갔다 ✌🏿✌🏿 깔루아밀크에 휘핑올려주는거 진심느좋......... ~                            은혜언니랑 울동네에서 4차까지 ㅎㅎㅎㅎ............ 인하대 천지인 딸막 당도최고                                              그네를 참 자주탔슨 (21살 먹고 빠진 것...  그네타기, 인형뽑기, 비즈놀이 )((님들이자꾸 귀여워해주니까 유아퇴행하자나 ㅋㅋ 막이래))그네 타면서 동네 고양이 만지고 책읽고 그랬는데요즘엔 동네꼬마들한테 맨날 자리 뺏겨서 ㅠㅠ ;; 옆동네까지 가서 그네를 탐 흑흑                    올해 빼빼로는 권력잇게, 제 돈으로 직접, 5개 맛별로 다 사먹었습니다?너도 내가 우습냐..                           레미 팝업도 갔어요 선우네 학교 쪽에 있어서 선우랑 갔음선우가 지나다니면서 볼때마다 저런곳은 누가갈까? 했는데그게 나일줄 몰랐대요...........                                이태원에서 엄지렐라랑 보낸 느좋데이또가자 ~ ㅎㅎ                                                             그리고 첫눈이옴 !!!!!!!!!!!!!!!!!!!!!올해첫눈이 유독 기억에 남는이유- 신나서 부츠신었다가 발 다젖어서 택시탐 택시비 2만원나옴- 개추워보이는 횃불이 자만추- 문학 수업때 첫눈뷰 창밖으로 보면서 사랑소설 가지고 토론함- 새벽에 혼자 일어나서 옥상에서 눈사람 만들었는데 너무 커서 머리 못올림, 그냥 눈 두 덩이 굴린 사람됨                             올겨울엔 맘먹구 나름? 고가의 핑크패딩을 샀는데사이즈가 약간 커서 (엄지아가 말린이유가 있었음 ;;) 잘 안입게 되네요...... 그치만 헬스갈땐 자주 입습니다?^^                                             엄마렐라가 릴스에서 찾은 감성카페에서 크리스마스 놀이했는데저희 옴마 너무 예쁘죠 ㅠㅠ? 아빠는? 아빠는 그냥 아저씨. ㅎㅎ                           즐거웠던 영문인의밤 ㅎㅎ !!난 한 게 없는데 왜 꽃다발이랑 사진을 찍었을까                           너무(정말너무너무...) 힘들었던 시험기간. (공부하는사진도없움) 감기랑 겹쳐서 정말너무너무 힘들엇고 공부하기 너무 싫어서 공부도 안하고 맨날 누워서 울며겨자먹음 ㅠㅠ다시는 겪고싶지안아지옥의 final exam week.......                           그래도 네일은 함 부평까지가서                                이건 종강날 (ㅠㅠㅠㅠㅠㅠㅠㅠㅠ) 저 혼자 집에서 종강기념 참치를 시켜먹었는데 진짜 너무맛있었어요 !!!!!!!!!!!!!!!!!갠적으로 올 겨울 방어 많이 먹었는데방어&lt;&lt;&lt;&lt;참치임 진짜                            탄핵코어 (막이래.......)윤석열 탄핵 안될까봐 라이브 켜놓고 시험공부하는 우리.........                    소으니네 크림모카 ㅎㅎ 🤍🤍 (귀여워서첨부)                                우리집 똥개강아 ㅎㅎ🤍🤍 (못생겨서첨부)                                저히집 거실에도 이때즈음에 트리가 생겼어욤 ㅎㅎ그리고 에픽에 돈 주면 저런 사진 생성이 가능하더라고요?25년에는 좀 자주 써보도록 할게요?                                은혜언니랑 하동균 콘서트 감 넘 좋았는데 몸이너무안좋아서 ....... 재밋게 못즐긴게 아수웠당몸이 안좋아도 와인은 꼭 마셔주기얌 ✌🏿🤧 ㅋㅋ. 그게여자니까                           그리고 다음날 바로 B형독감판정받고 죽음올해 독감 진짜 도칸감기....... 덕분에 파티룸도 취소하고 죽음의 크리스마스 주간을 보냈답니다?(케이크는 선우가 잘 먹었다네요)                           독감때문에 밖에 나가지도 못하고......집에서 크리스마스 파티함 동생이랑 근데                    hear me out cake 만들었는데요                                             어떤가요?흡사 가능케이크 (x) 사심케이크 (o)                                그리구 크리스마스 당일날  동기언니들이랑 호캉스를했어요간식만들기 놀이하면서 진대하궁 ㅎㅎㅎ , 가요대전보고, 잠자고, 쓸선주도함 !!!!!                                우리가 몇차까지 했는지 봐봐                    제가 올해 2학기에 참 많이 의지하고 같이 학교생활하며 즐거웠던 언니들이에욤 ✨️✨️🥲 .......... (+소연웅냐)내년도 많관부많사부 ~ to 막내 (is me ) ㅎㅎㅎㅎ 사랑행                           그리고 어김없이 독감코어 again nnnn.. 누구보다 푹 쉬었던 연말                                그리고 12월 30일에는 몸이 많이 괜찮아져서카페가서 혼자 연말정산하고 다이어리 사구 그렇게 한해를 마무리했어요                                      그리고 31일 마지막 날은 전순원들이랑 ㅎㅎ                                           즐거운 시간 보내게 해줘서 고맙고 나를 누구보다 많이 사랑해준 언니오빠들 🤧 (이랑 군대간 성현이)..사랑해사랑해 사랑해 ~~~~~~~~~ 그리고 사랑하는 사람들 얼굴보면서 happy new year ~한해를 마무리 했답니다?                    드뎌 끝 ㅎㅎㅎ2024년 한 게 별로 없다고 생각했는데요,한해를 돌아보니 한 거 너무 많아서 돌아보는데도 1억년이 걸렸네요 ㅋㅋ2024년 탈도 많고 실수도 잦았고 고생도 많이 했지만살면서 가장 다채롭고 행복한 한 해 였어욤(정말임) 작고 새로운 도전들도 많이 했고, 정말 많이 놀았고, 공부도 열심히했고, 운동도 많이 했고, 어쩌고저쩌고그 숱한 과정마다 옆에 있어줘서 감사합니다? (꾸벅)덕분에 정말 한순간도 외롭지 않았어요 !!!                    신년에는 슬픈 마음들이 적게 덜 슬펐으면 좋겠네요나쁜 사람들도 뉴스에 좀 안보였으면 좋겠고...울고 있는 사람들은 꼭 안아주고.. 그랬으면 좋겠다는개인적인 바램이 있습니다 모두의 바램일거라 믿어요새해에도 다들 건강하시길! 저도건강할게요그리고 행복하세요 저도행복할테니....bye                         ]",20250103
